,place,place_address,station_name,station_address,distance
440,Colegio Nuestra Señora de Fátima. Calle Alcalá,CALLE ALCALA 292,Bicipark Salamanca,Pl. del Marqués de Salamanca,2405.94
441,Colegio Nuestra Señora de Fátima. Calle Manuel Muñoz,CALLE MANUEL MUÑOZ 30,Bicipark Canalejas,-,3664.51
442,Colegio Nuestra Señora de Gracia,PASEO GIGANTES Y CABEZUDOS 12,Bicipark Canalejas,-,6479.13
443,Colegio Nuestra Señora de la Consolación,PLAZA MADRE MOLAS 2,Bicipark Recuerdo,"Calle Hiedra, 26",1141.95
444,Colegio Nuestra Señora de la Estrella,CALLE CRUCERO BALEARES 1,Bicipark Montalban,"Calle de Montalbán, 5",3717.26
445,Colegio Nuestra Señora de la Merced. Avenida Alfonso XIII,AVENIDA ALFONSO XIII 165,Bicipark Recuerdo,"Calle Hiedra, 26",1363.33
446,Colegio Nuestra Señora de la Merced. Calle José Luis Arrese,CALLE JOSE LUIS DE ARRESE 5,Bicipark Salamanca,Pl. del Marqués de Salamanca,2230.78
447,Colegio Nuestra Señora de la Merced. Calle Zaida,CALLE ZAIDA 87 OTRA ENTRADA POR C/ JOSE GARRIDO 10,Bicipark Canalejas,-,4165.13
448,Colegio Nuestra Señora de la Paz,CALLE VALDERRIBAS 37,Bicipark Montalban,"Calle de Montalbán, 5",1926.21
449,Colegio Nuestra Señora de la Providencia,CALLE MONEDEROS 2,Bicipark Canalejas,-,3181.28
450,Colegio Nuestra Señora de la Vega,CALLE CHANTADA 28,Bicipark Pitis,"Calle Pau Arroyo del Fresno, 181",2718.8
451,Colegio Nuestra Señora de las Delicias,PASEO DELICIAS 67,Bicipark Canalejas,-,2257.24
452,Colegio Nuestra Señora de las Escuelas Pias. Calle Eugenia de Montijo,CALLE EUGENIA DE MONTIJO 83,Bicipark Aviación,Parking Aviación Española,2931.38
453,Colegio Nuestra Señora de las Escuelas Pias. Calle Ocaña,CALLE OCAÑA 191,Bicipark Aviación,Parking Aviación Española,2615.37
454,Colegio Nuestra Señora de las Maravillas,CALLE GUADALQUIVIR 9,Bicipark Orense,"Avenida General Perón, 27",889.63
455,Colegio Nuestra Señora de las Nieves,CALLE ALCALA 589,Bicipark Salamanca,Pl. del Marqués de Salamanca,5800.34
456,Colegio Nuestra Señora de las Victorias,CALLE APOSTOL SANTIAGO 72,Bicipark Salamanca,Pl. del Marqués de Salamanca,2090.51
457,Colegio Nuestra Señora de Loreto - Real Colegio,CALLE O'DONELL 61,Bicipark Salamanca,Pl. del Marqués de Salamanca,1286.43
458,Colegio Nuestra Señora de Loreto. Calle General Aranaz,CALLE GENERAL ARANAZ 66,Bicipark Salamanca,Pl. del Marqués de Salamanca,3520.61
459,Colegio Nuestra Señora de Loreto. Calle Príncipe de Vergara,CALLE PRINCIPE DE VERGARA 42,Bicipark Salamanca,Pl. del Marqués de Salamanca,252.37
460,Colegio Nuestra Señora de los Ángeles,CALLE LA CANCION DEL OLVIDO 55,Bicipark Canalejas,-,6908.89
461,Colegio Nuestra Señora de los Dolores,CALLE TORDO 15,Bicipark Canalejas,-,4098.93
462,Colegio Nuestra Señora de Moratalaz,AVENIDA MORATALAZ 91,Bicipark Montalban,"Calle de Montalbán, 5",3238.47
463,Colegio Nuestra Señora de Santa María,RONDA SOBRADIEL 80,Bicipark Recuerdo,"Calle Hiedra, 26",3470.73
464,Colegio Nuestra Señora del Buen Consejo. Calle Ábalos,CALLE ABALOS 5,Bicipark Salamanca,Pl. del Marqués de Salamanca,2947.61
465,Colegio Nuestra Señora del Buen Consejo. Calle Juan Montalvo,CALLE JUAN MONTALVO 30,Bicipark Orense,"Avenida General Perón, 27",1710.73
466,Colegio Nuestra Señora del Carmen,AVENIDA REAL DE PINTO 41,Bicipark Aviación,Parking Aviación Española,7812.37
467,Colegio Nuestra Señora del Pilar. Calle Castelló,CALLE CASTELLO 56,Bicipark Salamanca,Pl. del Marqués de Salamanca,281.21
468,Colegio Nuestra Señora del Pilar. Calle San Benito,CALLE SAN BENITO 6,Bicipark Recuerdo,"Calle Hiedra, 26",1058.7
469,Colegio Nuestra Señora del Pilar. Calle Sanchez Preciados,CALLE SANCHEZ PRECIADOS 62,Bicipark Orense,"Avenida General Perón, 27",1741.08
470,Colegio Nuestra Señora del Recuerdo,PLAZA DUQUE DE PASTRANA 5,Bicipark Recuerdo,"Calle Hiedra, 26",441.65
471,Colegio Nuestra Señora del Sagrado Corazón,CALLE GRANDEZA ESPA&amp;Ntilde;OLA 89,Bicipark Canalejas,-,3161.55
472,Colegio Nueva Castilla,CALLE MAZATERON 12,Bicipark Montalban,"Calle de Montalbán, 5",8171.87
473,Colegio Nuevo Equipo,CALLE LOPEZ DE ARANDA 5,Bicipark Salamanca,Pl. del Marqués de Salamanca,3564.47
474,Colegio Nuevo Velázquez,CALLE ROSA JARDON 9,Bicipark Recuerdo,"Calle Hiedra, 26",1103.71
475,Colegio Obispo Perelló,CALLE VIRGEN DEL SAGRARIO 22,Bicipark Salamanca,Pl. del Marqués de Salamanca,2629.01
476,Colegio Obra Social Nuestra Señora de Montserrat - San Simón y San Judas,CALLE TREVELEZ 3,Bicipark Canalejas,-,5853.72
477,Colegio Padre Piquer,CALLE CAÑAVERAL 96,Bicipark Recuerdo,"Calle Hiedra, 26",1074.65
478,Colegio Paraíso Sagrados Corazones,CALLE PADRE DAMIAN 34,Bicipark Orense,"Avenida General Perón, 27",852.28
479,Colegio Parque Conde de Orgaz,CALLE GREGORIO BENITEZ 25,Bicipark Salamanca,Pl. del Marqués de Salamanca,3620.27
480,Colegio Patrocinio de María,"CALLE UMBRIA 31 TAMBIEN C/ JULIAN HERNANDEZ, 14",Bicipark Recuerdo,"Calle Hiedra, 26",3278.9
481,Colegio Patrocinio de San José,CALLE EDGAR NEVILLE 24,Bicipark Orense,"Avenida General Perón, 27",389.75
482,Colegio Pedagogía Waldorf de Aravaca,CALLE ZENIT 10,Bicipark Pitis,"Calle Pau Arroyo del Fresno, 181",6606.49
483,Colegio Público Adolfo Suárez,CALLE INFANTA CATALINA MICAELA 31,Bicipark Fuente de la Mora,Estación de Fuente de la Mora,990.17
484,Colegio Público Agustín Rodriguez Sahagún,CALLE LA GRANJA DE SAN ILDEFONSO 17,Bicipark Montalban,"Calle de Montalbán, 5",8050.55
485,Colegio Público Agustina Díez,CALLE VESUBIO 5,Bicipark Montalban,"Calle de Montalbán, 5",4969.16
486,Colegio Público Alberto Alcocer,AVENIDA CANILLEJAS A VICALVARO 56,Bicipark Salamanca,Pl. del Marqués de Salamanca,5690.9
487,Colegio Público Alcalde de Móstoles,CALLE ALDEANUEVA DE LA VERA 9,Bicipark Aviación,Parking Aviación Española,736.18
488,Colegio Público Alfredo di Stefano,calle felix candela 4,Bicipark Salamanca,Pl. del Marqués de Salamanca,5690.9
489,Colegio Público Alhambra,CALLE RAMON GOMEZ DE LA SERNA 103,Bicipark Pitis,"Calle Pau Arroyo del Fresno, 181",1392.65
490,Colegio Público Álvaro de Bazan,CALLE ZURICH 10,Bicipark Salamanca,Pl. del Marqués de Salamanca,6166.26
491,Colegio Público Amadeo Vives,CALLE LOS YEBENES 6,Bicipark Aviación,Parking Aviación Española,2854.78
492,Colegio Público Amador de los Ríos,PASEO MARQUES DE ZAFRA 16,Bicipark Salamanca,Pl. del Marqués de Salamanca,1158.16
493,Colegio Público Amós Acero,CALLE RODRIGUEZ ESPINOSA 54,Bicipark Montalban,"Calle de Montalbán, 5",3856.3
494,Colegio Público Angel Nieto,AVENIDA LAS SUERTES 109,Bicipark Montalban,"Calle de Montalbán, 5",10792.62
495,Colegio Público Antonio de Nebrija,CALLE JUAN JOSE MARTINEZ SECO 77,Bicipark Montalban,"Calle de Montalbán, 5",7380.2
496,Colegio Público Antonio Fontan,AVENIDA SANTUARIO DE VALVERDE 71,Bicipark Pitis,"Calle Pau Arroyo del Fresno, 181",3152.01
497,Colegio Público Antonio Machado,CALLE ALLARIZ 3,Bicipark Aviación,Parking Aviación Española,3071.68
498,Colegio Público Antonio Moreno Rosales,CALLE OLMO 4,Bicipark Canalejas,-,721.38
499,Colegio Público Aragón,AVENIDA RAFAEL ALBERTI 2,Bicipark Montalban,"Calle de Montalbán, 5",5349.44
500,Colegio Público Aravaca,CALLE ESTUDIO 6,Bicipark Pitis,"Calle Pau Arroyo del Fresno, 181",6473.12
501,Colegio Público Arcipreste de Hita,CALLE ANTONIO MORENO 25,Bicipark Canalejas,-,4283.84
502,Colegio Público Arquitecto Gaudí,CALLE ROSA JARDON 10,Bicipark Recuerdo,"Calle Hiedra, 26",1140.49
503,Colegio Público Asturias,CALLE ASTURIANOS 2,Bicipark Montalban,"Calle de Montalbán, 5",5641.28
504,Colegio Público Ausias March,CALLE ESTEFANITA 9,Bicipark Montalban,"Calle de Montalbán, 5",8312.68
505,Colegio Público Azorín,CALLE GODELLA 57,Bicipark Montalban,"Calle de Montalbán, 5",8372.35
506,Colegio Público Barcelona,AVENIDA LA VERBENA DE LA PALOMA 14,Bicipark Canalejas,-,6610.17
507,Colegio Público Blas de Lezo,CALLE FROMISTA 27,Bicipark Fuente de la Mora,Estación de Fuente de la Mora,3060.93
508,Colegio Público Blas de Otero,CALLE PUENTELARRA 34,Bicipark Montalban,"Calle de Montalbán, 5",7834.43
509,Colegio Público Bolivia,CALLE VILLAVALIENTE 29,Bicipark Aviación,Parking Aviación Española,3925.61
510,Colegio Público Bravo Murillo,CALLE ISLAS CIES 11,Bicipark Pitis,"Calle Pau Arroyo del Fresno, 181",1809.45
511,Colegio Público Breogán,CALLE GINZO DE LIMIA 2,Bicipark Recuerdo,"Calle Hiedra, 26",2015.59
512,Colegio Público Calderón de la Barca,CALLE CALDERON 2,Bicipark Fuente de la Mora,Estación de Fuente de la Mora,6864.13
513,Colegio Público Camilo José Cela,CALLE MELCHOR FERNANDEZ ALMAGRO 22,Bicipark Recuerdo,"Calle Hiedra, 26",1925.14
514,Colegio Público Capitán Cortés,CALLE MONSEÑOR OSCAR ROMERO 17,Bicipark Aviación,Parking Aviación Española,3471.51
515,Colegio Público Cardenal Herrera Oria,CALLE FERMIN CABALLERO 68,Bicipark Pitis,"Calle Pau Arroyo del Fresno, 181",1888.85
516,Colegio Público Carlos Sáinz de los Terreros,CALLE CARTAMA 1,Bicipark Montalban,"Calle de Montalbán, 5",5739.86
517,Colegio Público Carlos V,CALLE VIRGEN DEL VAL 3,Bicipark Salamanca,Pl. del Marqués de Salamanca,2233.28
518,Colegio Público Carmen Cabezuelo,CALLE CANGAS DE ONIS 7,Bicipark Salamanca,Pl. del Marqués de Salamanca,4260.68
519,Colegio Público Carmen Laforet,CALLE TITANIO 16,Bicipark Salamanca,Pl. del Marqués de Salamanca,7546.51
520,Colegio Público Cervantes,CALLE RAIMUNDO FERNANDEZ VILLAVERDE 4,Bicipark Orense,"Avenida General Perón, 27",1052.83
521,Colegio Público Ciudad de Córdoba,CALLE LILLO 1,Bicipark Canalejas,-,6149.76
522,Colegio Público Ciudad de Guadalajara,CALLE BERGANTIN 13,Bicipark Fuente de la Mora,Estación de Fuente de la Mora,7213.25
523,Colegio Público Ciudad de los Ángeles,CALLE LA ALEGRIA DE LA HUERTA 6,Bicipark Canalejas,-,6918.0
524,Colegio Público Ciudad de Valencia,AVENIDA MEDITERRANEO 91,Bicipark Salamanca,Pl. del Marqués de Salamanca,8072.9
525,Colegio Público Ciudad de Zaragoza,CALLE MANUEL AGUILAR MUÑOZ 1,Bicipark Fuente de la Mora,Estación de Fuente de la Mora,6654.76
526,Colegio Público Ciudad Pegaso,AVENIDA SEPTIMA 12,Bicipark Fuente de la Mora,Estación de Fuente de la Mora,6899.93
527,Colegio Público Claudio Moyano,CALLE CEA BERMUDEZ 26,Bicipark Almagro,"Calle Almagro, 11",1655.03
528,Colegio Público Complejo Escolar Príncipe Felipe,AVENIDA MONFORTE DE LEMOS 24,Bicipark Recuerdo,"Calle Hiedra, 26",2059.93
529,Colegio Público Concepción Arenal,CALLE ANTONIO LOPEZ 1,Bicipark Canalejas,-,2614.01
530,Colegio Público Concha Espina,CALLE GERARDO DIEGO 6,Bicipark Montalban,"Calle de Montalbán, 5",5355.68
531,Colegio Público Conde de Romanones,CALLE ELFO 143,Bicipark Salamanca,Pl. del Marqués de Salamanca,3218.13
532,Colegio Público Cortes de Cádiz,AVENIDA NICETO ALCALA ZAMORA 48,Bicipark Fuente de la Mora,Estación de Fuente de la Mora,1693.03
533,Colegio Público Costa Rica,CALLE CAMARENA 247,Bicipark Aviación,Parking Aviación Española,2357.27
534,Colegio Público Cristóbal Colón,CARRETERA CARABANCHEL A VILLAVERDE 109,Bicipark Canalejas,-,7521.71
535,Colegio Público Cuba,CALLE TEMBLEQUE 58,Bicipark Aviación,Parking Aviación Española,2285.88
536,Colegio Público Dámaso Alonso,AVENIDA ESPINELA 1,Bicipark Aviación,Parking Aviación Española,7578.49
537,Colegio Público Daniel Vázquez Díaz,CALLE ARMENTEROS 46,Bicipark Orense,"Avenida General Perón, 27",2083.54
538,Colegio Público de Educación Especial Cátedra de Pediatría Hospital Clínico,CALLE PROFESOR MARTIN LAGOS 2,Bicipark Almagro,"Calle Almagro, 11",2485.17
539,Colegio Público de Educación Especial Francisco del Pozo,CALLEJON DOMINE 6,Bicipark Fuente de la Mora,Estación de Fuente de la Mora,2247.52
540,Colegio Público de Educación Especial Fray Pedro Ponce de León,CALLE LOS YEBENES 76,Bicipark Aviación,Parking Aviación Española,2856.59
541,Colegio Público de Educación Especial Fundación Goyeneche,CALLE ARCOS DE JALON 22,Bicipark Salamanca,Pl. del Marqués de Salamanca,5027.14
542,Colegio Público de Educación Especial Hospital del Niño Jesús,AVENIDA MENENDEZ PELAYO 65,Bicipark Montalban,"Calle de Montalbán, 5",1261.97
543,Colegio Público de Educación Especial Hospital Gregorio Marañón,CALLE 50,Bicipark Salamanca,Pl. del Marqués de Salamanca,1229.74
544,Colegio Público de Educación Especial Infanta Elena,AVENIDA BADAJOZ 76,Bicipark Salamanca,Pl. del Marqués de Salamanca,2872.65
545,Colegio Público de Educación Especial Inmaculada Concepción,CALLE SALDAÑA 30,Bicipark Canalejas,-,3821.0
546,Colegio Público de Educación Especial La Quinta,CARRETERA SOMONTES AL PALACIO DE LA REAL QUINTA 1,Bicipark Fuente de la Mora,Estación de Fuente de la Mora,
547,Colegio Público de Educación Especial María Soriano,AVENIDA PESETA 30,Bicipark Aviación,Parking Aviación Española,2928.61
548,Colegio Público de Educación Especial Vallecas,CARRETERA VALENCIA (Recinto Universitario) 7,Bicipark Salamanca,Pl. del Marqués de Salamanca,6315.52
549,Colegio Público de Prácticas Asunción Rincón,AVENIDA FILIPINAS 5,Bicipark Almagro,"Calle Almagro, 11",1863.49
550,Colegio Público Dionisio Ridruejo,CALLE ZIPAQUIRA 14,Bicipark Fuente de la Mora,Estación de Fuente de la Mora,2739.22
551,Colegio Público Doctor Conde Arruga,CALLE HACIENDA DE PAVONES 105,Bicipark Salamanca,Pl. del Marqués de Salamanca,4213.77
552,Colegio Público Doctor Federico Rubio,AVENIDA DOCTOR FEDERICO RUBIO Y GALI 53,Bicipark Orense,"Avenida General Perón, 27",1477.76
553,Colegio Público Doctor Severo Ochoa,CALLE EZCARAY 3,Bicipark Salamanca,Pl. del Marqués de Salamanca,5973.54
554,Colegio Público Doctor Tolosa Latour,CALLE ASTURIANOS 4,Bicipark Montalban,"Calle de Montalbán, 5",5763.11
555,Colegio Público Eduardo Rojo,CALLE EDUARDO ROJO 5,Bicipark Montalban,"Calle de Montalbán, 5",4157.07
556,Colegio Público EEUU - Huarte de San Juan,PASEO COMANDANTE FORTEA 71,Bicipark Canalejas,-,3142.78
557,Colegio Público El Espinillo,CALLE UNANIMIDAD 1,Bicipark Canalejas,-,6274.88
558,Colegio Público El Greco,CALLE ESTEFANITA 7,Bicipark Montalban,"Calle de Montalbán, 5",8189.99
559,Colegio Público El Madroño,CALLE LAS MARISMAS 14,Bicipark Montalban,"Calle de Montalbán, 5",3547.75
560,Colegio Público El Quijote,CALLE FUENTIDUEÑA 4,Bicipark Montalban,"Calle de Montalbán, 5",7435.59
561,Colegio Público El Sol,AVENIDA CANILLEJAS A VICALVARO 82,Bicipark Salamanca,Pl. del Marqués de Salamanca,5755.51
562,Colegio Público Emilia Pardo Bazán,CALLE VENTORRILLO 14,Bicipark Canalejas,-,1329.99
563,Colegio Público Ermita del Santo,PASEO ERMITA DEL SANTO 18,Bicipark Canalejas,-,2167.66
564,Colegio Público Esperanza,CALLE ANDORRA 12,Bicipark Fuente de la Mora,Estación de Fuente de la Mora,2969.31
565,Colegio Público Eugenio María de Hostos,CALLE VALDEVARNES 26,Bicipark Orense,"Avenida General Perón, 27",2705.87
566,Colegio Público Felipe II,AVENIDA ASTURIAS 70,Bicipark Recuerdo,"Calle Hiedra, 26",1728.2
567,Colegio Público Fernández de Moratín,AVENIDA VALLADOLID 2,Bicipark Canalejas,-,2558.62
568,Colegio Público Fernando el Católico,CALLE FERNANDO EL CATOLICO 16,Bicipark Almagro,"Calle Almagro, 11",1486.48
569,Colegio Público Filósofo Séneca,CALLE SANTA ADELA 21,Bicipark Fuente de la Mora,Estación de Fuente de la Mora,1291.76
570,Colegio Público Fontarrón,CALLE ARROYO FONTARRON 24,Bicipark Montalban,"Calle de Montalbán, 5",5479.42
571,Colegio Público Francisco Arranz,CALLE SONDICA 2,Bicipark Aviación,Parking Aviación Española,2024.01
572,Colegio Público Francisco de Goya,CALLE ANTILLON 23,Bicipark Canalejas,-,2509.59
573,Colegio Público Francisco de Luis,CALLE CORREGIDOR RODRIGO RODRIGUEZ 5,Bicipark Montalban,"Calle de Montalbán, 5",2781.38
574,Colegio Público Francisco de Quevedo,CALLE GRANADA 16,Bicipark Montalban,"Calle de Montalbán, 5",1779.5
575,Colegio Público Francisco Fatóu,CAMINO SUERTE 23,Bicipark Montalban,"Calle de Montalbán, 5",7715.07
576,Colegio Público Francisco Ruano,CALLE ALMURADIEL 150,Bicipark Montalban,"Calle de Montalbán, 5",4476.8
577,Colegio Público Gabriela Mistral,CALLE MIRALLOS 3,Bicipark Fuente de la Mora,Estación de Fuente de la Mora,2591.85
578,Colegio Público García Morente,RONDA SUR 229,Bicipark Montalban,"Calle de Montalbán, 5",5420.76
579,Colegio Público Garcilaso de la Vega,CALLE TREFACIO 18,Bicipark Fuente de la Mora,Estación de Fuente de la Mora,3141.51
580,Colegio Público Giner de los Ríos,CALLE MEMBEZAR 25,Bicipark Montalban,"Calle de Montalbán, 5",4691.17
581,Colegio Público Gloria Fuertes,CALLE CENSO 3,Bicipark Canalejas,-,5413.97
582,Colegio Público Gonzalo de Berceo,AVENIDA ABRANTES 5,Bicipark Canalejas,-,4146.05
583,Colegio Público Gonzalo Fernández de Córdoba,CALLE ADANERO 3,Bicipark Aviación,Parking Aviación Española,1241.45
584,Colegio Público Guindalera,CALLE BOSTON 3,Bicipark Salamanca,Pl. del Marqués de Salamanca,1287.88
585,Colegio Público Gustavo Adolfo Bécquer,CALLE SANTA GENOVEVA 32,Bicipark Salamanca,Pl. del Marqués de Salamanca,2644.72
586,Colegio Público Haití,CALLE GUABAIRO 22,Bicipark Aviación,Parking Aviación Española,3176.32
587,Colegio Público Hermanos Pinzón,CALLE AZOR 4,Bicipark Aviación,Parking Aviación Española,2099.08
588,Colegio Público Hernán Cortés,CALLE LOS YEBENES 241,Bicipark Aviación,Parking Aviación Española,2875.45
589,Colegio Público Honduras,PASEO FEDERICO GARCIA LORCA 19,Bicipark Montalban,"Calle de Montalbán, 5",7438.24
590,Colegio Público Hortaleza,CALLE VALDETORRES DE JARAMA 1,Bicipark Fuente de la Mora,Estación de Fuente de la Mora,1880.02
591,Colegio Público Ignacio Zuloaga,CALLE ALEJANDRO RODRIGUEZ 34,Bicipark Orense,"Avenida General Perón, 27",1533.91
592,Colegio Público Infanta Leonor,CALLE MONASTERIO DE EL PAULAR 140,Bicipark Pitis,"Calle Pau Arroyo del Fresno, 181",1212.92
593,Colegio Público Isaac Peral,GLORIETA RUFINO NOVALVOS 5,Bicipark Canalejas,-,4402.47
594,Colegio Público Jaime Balmes,CALLE SIERRA DE LA SOLANA 2,Bicipark Montalban,"Calle de Montalbán, 5",3766.04
595,Colegio Público Jaime Vera,CALLE BRAVO MURILLO 162,Bicipark Orense,"Avenida General Perón, 27",769.05
596,Colegio Público Javier de Miguel,CALLE JAVIER DE MIGUEL 90,Bicipark Montalban,"Calle de Montalbán, 5",4551.75
597,Colegio Público Joaquín Costa,PASEO PONTONES 8,Bicipark Canalejas,-,1869.5
598,Colegio Público Joaquín Dicenta,PASEO OLIVOS 70,Bicipark Canalejas,-,3563.33
599,Colegio Público Joaquín Turina,CALLE ARTURO SORIA 332,Bicipark Fuente de la Mora,Estación de Fuente de la Mora,527.35
600,Colegio Público Jorge Guillén,AVENIDA EL FERROL 47,Bicipark Recuerdo,"Calle Hiedra, 26",2456.13
601,Colegio Público Jorge Manrique,PLAZA PINTOR LUCAS 17,Bicipark Canalejas,-,3429.51
602,Colegio Público José Bergamín,CALLE BRAILLE 19,Bicipark Pitis,"Calle Pau Arroyo del Fresno, 181",2441.35
603,Colegio Público José Calvo Sotelo,AVENIDA CIUDAD DE BARCELONA 83,Bicipark Montalban,"Calle de Montalbán, 5",2403.96
604,Colegio Público José de Echegaray,CALLE PUENTEDEY 14,Bicipark Montalban,"Calle de Montalbán, 5",8514.95
605,Colegio Público José María de Pereda,CALLE MESTANZA 94,Bicipark Montalban,"Calle de Montalbán, 5",4256.25
606,Colegio Público Josep Tarradellas,CALLE TRIACASTELA 1,Bicipark Fuente de la Mora,Estación de Fuente de la Mora,2854.61
607,Colegio Público Jovellanos,CALLE MONROY 34,Bicipark Aviación,Parking Aviación Española,472.92
608,Colegio Público Juan Gris,CALLE MUELA DE SAN JUAN 31,Bicipark Montalban,"Calle de Montalbán, 5",8018.2
609,Colegio Público Juan Ramón Jiménez,CALLE MARQUES DE VIANA 58,Bicipark Orense,"Avenida General Perón, 27",1391.58
610,Colegio Público Juan Sebastián Elcano,CALLE MIRASIERRA 29,Bicipark Canalejas,-,3229.9
611,Colegio Público Juan Zaragüeta,CALLE VIA DE LOS POBLADOS 19,Bicipark Fuente de la Mora,Estación de Fuente de la Mora,3050.93
612,Colegio Público Julián Besteiro,AVENIDA ABRANTES 79,Bicipark Aviación,Parking Aviación Española,4718.29
613,Colegio Público Julián Marías,CALLE BUDAPEST 11,Bicipark Salamanca,Pl. del Marqués de Salamanca,6492.83
614,Colegio Público La Dehesa del Príncipe,PASEO LANCEROS 4,Bicipark Aviación,Parking Aviación Española,962.27
615,Colegio Público La Latina,CALLE MAQUEDA 130,Bicipark Aviación,Parking Aviación Española,1931.02
616,Colegio Público La Rioja,CALLE LEON FELIPE 3,Bicipark Montalban,"Calle de Montalbán, 5",5644.52
617,Colegio Público Leopoldo Alas,CALLE PEDREZUELA 18,Bicipark Salamanca,Pl. del Marqués de Salamanca,2190.76
618,Colegio Público Leopoldo Calvo Sotelo,CALLE CASTIELLO DE JACA 2,Bicipark Fuente de la Mora,Estación de Fuente de la Mora,2065.75
619,Colegio Público Lepanto,CALLE VALDERREY 9,Bicipark Orense,"Avenida General Perón, 27",2869.44
620,Colegio Público Lope de Vega,CALLE INGLATERRA 8,Bicipark Canalejas,-,3273.17
621,Colegio Público Lorenzo Luzuriaga,CALLE VALENCIA DE DON JUAN 13,Bicipark Pitis,"Calle Pau Arroyo del Fresno, 181",2225.36
622,Colegio Público Los Almendros,CALLE LADERA DE LOS ALMENDROS 45,Bicipark Salamanca,Pl. del Marqués de Salamanca,5894.98
623,Colegio Público Los Rosales,AVENIDA LOS ROSALES 131,Bicipark Montalban,"Calle de Montalbán, 5",7463.52
624,Colegio Público Loyola de Palacio,CALLE EMBALSE DE NAVACERRADA 60,Bicipark Montalban,"Calle de Montalbán, 5",10101.39
625,Colegio Público Luis Bello,CALLE LUIS CABRERA 66,Bicipark Salamanca,Pl. del Marqués de Salamanca,1560.62
626,Colegio Público Luis Cernuda,CALLE CARRIL DEL CONDE 64,Bicipark Recuerdo,"Calle Hiedra, 26",2443.95
627,Colegio Público Luis de Góngora,CALLE SARRIA 49,Bicipark Pitis,"Calle Pau Arroyo del Fresno, 181",2534.21
628,Colegio Público Madrid Sur,CALLE PUERTO DE BALBARAN 133,Bicipark Montalban,"Calle de Montalbán, 5",5510.95
629,Colegio Público Maestro Padilla,AVENIDA PESETA 112,Bicipark Aviación,Parking Aviación Española,3852.73
630,Colegio Público Manuel Bartolomé Cossío,CALLE JOSE DE CADALSO 19,Bicipark Aviación,Parking Aviación Española,1040.98
631,Colegio Público Manuel de Falla,CALLE JOSE ORTU&amp;Ntilde;O PONCE 2,Bicipark Aviación,Parking Aviación Española,7811.78
632,Colegio Público Manuel Núñez de Arenas,CALLE MARTOS 120,Bicipark Montalban,"Calle de Montalbán, 5",5366.28
633,Colegio Público Manuel Sáinz de Vicuña,CALLE CAMINO DE LOS VINATEROS 104,Bicipark Salamanca,Pl. del Marqués de Salamanca,3390.28
634,Colegio Público Marcelo Usera,CALLE PERALES DE TAJUÑA 1,Bicipark Canalejas,-,3408.31
635,Colegio Público María de Villota,CALLE ENRIQUE GARCIA ALVAREZ 11,Bicipark Montalban,"Calle de Montalbán, 5",7541.06
636,Colegio Público Mariano José de Larra,CALLE LONGARES 11,Bicipark Salamanca,Pl. del Marqués de Salamanca,5941.71
637,Colegio Público Marqués de Marcenado,CALLE LINNEO 31,Bicipark Canalejas,-,1963.54
638,Colegio Público Méjico (México),AVENIDA BADAJOZ 74,Bicipark Salamanca,Pl. del Marqués de Salamanca,2811.97
639,Colegio Público Méndez Núñez,CALLE ALICUN 9,Bicipark Fuente de la Mora,Estación de Fuente de la Mora,697.86
640,Colegio Público Menéndez Pidal,CALLE ENCOMIENDA DE PALACIOS 85,Bicipark Salamanca,Pl. del Marqués de Salamanca,4617.29
641,Colegio Público Meseta de Orcasitas,CALLE CAMINO VIEJO DE VILLAVERDE 1,Bicipark Canalejas,-,5185.16
642,Colegio Público Mesonero Romanos,CALLE PONT DE MOLINS 31,Bicipark Montalban,"Calle de Montalbán, 5",4778.95
643,Colegio Público Miguel Blasco Vilatela,CALLE HERMANOS GARCIA NOBLEJAS 70,Bicipark Salamanca,Pl. del Marqués de Salamanca,3978.32
644,Colegio Público Miguel Servet,CALLE FRAGATA 33,Bicipark Canalejas,-,4117.92
645,Colegio Público Mirasierra,CALLE LA MASO 22,Bicipark Pitis,"Calle Pau Arroyo del Fresno, 181",1051.84
646,Colegio Público Monte de El Pardo,AVENIDA GUARDIA 19,Bicipark Pitis,"Calle Pau Arroyo del Fresno, 181",4793.01
647,Colegio Público Navas de Tolosa,CALLE BENIMAMET 109,Bicipark Montalban,"Calle de Montalbán, 5",8219.97
648,Colegio Público Nuestra Señora de la Almudena,CALLE LOPE DE RUEDA 48,Bicipark Montalban,"Calle de Montalbán, 5",1097.45
649,Colegio Público Nuestra Señora de la Concepción,CALLE VIRGEN DEL SAGRARIO 24,Bicipark Salamanca,Pl. del Marqués de Salamanca,2579.07
650,Colegio Público Nuestra Señora de la Fuencisla,CALLE TOMELLOSO 39,Bicipark Canalejas,-,4182.97
651,Colegio Público Nuestra Señora de la Luz,CALLE MAGNESIA 9,Bicipark Aviación,Parking Aviación Española,7961.39
652,Colegio Público Nuestra Señora de la Paloma,CALLE TABERNILLAS 2,Bicipark Canalejas,-,1256.75
653,Colegio Público Nuestra Señora del Lucero,CALLE MUÑICO 1,Bicipark Canalejas,-,3915.48
654,Colegio Público Nuria Espert,CALLE MARIA REICHE 34,Bicipark Fuente de la Mora,Estación de Fuente de la Mora,4410.41
655,Colegio Público Pablo Picasso,CALLE ANGEL LUIS DE LA HERRAN 35,Bicipark Fuente de la Mora,Estación de Fuente de la Mora,2049.23
656,Colegio Público Padre Coloma,CALLE GUTIERREZ CANALES 19,Bicipark Fuente de la Mora,Estación de Fuente de la Mora,5728.21
657,Colegio Público Padre Mariana,RONDA SUR 145,Bicipark Montalban,"Calle de Montalbán, 5",4859.9
658,Colegio Público Padre Poveda,AVENIDA ALFONSO XIII 23,Bicipark Orense,"Avenida General Perón, 27",2223.16
659,Colegio Público Palacio Valdés,PASEO PRADO 38,Bicipark Montalban,"Calle de Montalbán, 5",863.0
660,Colegio Público Palomeras Bajas,CALLE FELIPE DE DIEGO 6,Bicipark Montalban,"Calle de Montalbán, 5",5017.94
661,Colegio Público Parque Aluche,CALLE QUERO 47,Bicipark Aviación,Parking Aviación Española,2088.45
662,Colegio Público Parque Eugenia de Montijo,CALLE PARQUE EUGENIA DE MONTIJO 28,Bicipark Aviación,Parking Aviación Española,2714.16
663,Colegio Público Pasamonte,AVENIDA DOCTOR GARCIA TAPIA 47,Bicipark Salamanca,Pl. del Marqués de Salamanca,3312.93
664,Colegio Público Patriarca Obispo Eijo y Garay,CALLE LOPEZ DE HOYOS 40,Bicipark Salamanca,Pl. del Marqués de Salamanca,1063.5
