,place,place_address,station_name,station_address,distance
0,ABC Schule (Alemán),CALLE LEIZARAN 27,Bicipark Orense,"Avenida General Perón, 27",1198.13
1,Academia Darío Estudio,CALLE GRAN VIA 63,Bicipark Canalejas,-,1020.46
2,AFI Escuela de Finanzas,CALLE MARQUES DE VILLAMEJOR 5,Bicipark Almagro,"Calle Almagro, 11",460.95
3,Agencia Estatal Consejo Superior de Investigaciones Científicas (CSIC),CALLE SERRANO 115 BIS,Bicipark Almagro,"Calle Almagro, 11",1277.26
4,Alliance Française de Madrid,CUESTA SANTO DOMINGO 13,Bicipark Canalejas,-,837.67
5,"Altair, Colegio Internacional",CALLE JOAQUIN BAU 4,Bicipark Recuerdo,"Calle Hiedra, 26",1124.43
6,Área de Gobierno de Hacienda y Personal,CALLE ALCALA 45,Bicipark Canalejas,-,304.97
7,Aula de estudio de Manoteras. Sala de estudio (Hortaleza),CALLE CUEVAS DEL ALMANZORA 187,Bicipark Fuente de la Mora,Estación de Fuente de la Mora,866.05
8,Aula de Naturaleza Palacio Valdés,"CARRETERA COLMENAR VIEJO km 22,600 ",Bicipark Fuente de la Mora,Estación de Fuente de la Mora,
9,Aula Municipal de Formación de Personas Adultas. Distrito Centro.,CALLE CASINO 5,Bicipark Canalejas,-,1340.07
10,Aula Municipal de Formación de Personas Adultas. Distrito Chamberí,CALLE ALMAGRO 5 I.F.E. DEL GOBIERNO LOCAL DE MADRID,Bicipark Almagro,"Calle Almagro, 11",273.93
11,Aula Municipal de Formación de Personas Adultas. Distrito Ciudad Lineal.,CALLE SANTA FELICIDAD 39 EN CENTRO CULTURAL ELIPA,Bicipark Salamanca,Pl. del Marqués de Salamanca,2531.15
12,Aula Municipal de Formación de Personas Adultas. Distrito San Blas - Canillejas.,CALLE SAN ROMAN DEL VALLE 8 EN CENTRO CULTURAL ANTONIO MACHADO,Bicipark Salamanca,Pl. del Marqués de Salamanca,4983.2
13,Aula Municipal de Formación de Personas Adultas. Distrito Villaverde. Calle Doctor Martín Arévalo.,CALLE DOCTOR MARTIN AREVALO 2 CENTRO CULTURAL ÁGATA,Bicipark Aviación,Parking Aviación Española,7589.82
14,Aula Municipal de Formación de Personas Adultas. Distrito Villaverde. Plaza Los Pinazo.,PLAZA PINAZO 9,Bicipark Canalejas,-,8381.03
15,British Council Madrid,PASEO GENERAL MARTINEZ CAMPOS 31,Bicipark Almagro,"Calle Almagro, 11",548.1
16,Casa de Niños Daniel Vázquez Díaz,CALLE ARMENTEROS 46,Bicipark Orense,"Avenida General Perón, 27",2083.54
17,Casa de Niños Giner de los Ríos,CALLE MEMBEZAR 25,Bicipark Montalban,"Calle de Montalbán, 5",4691.17
18,Casa de Niños Lope de Vega,CALLE INGLATERRA 8 UBICADA EN C. P. LOPE DE VEGA,Bicipark Canalejas,-,3273.17
19,Casa de Niños Nuestra Señora de la Fuencisla,CALLE TOMELLOSO 40 UBICADA EN C.P. NTRA. SRA FUENCISLA,Bicipark Canalejas,-,4213.41
20,Casa de Niños República de Brasil,AVENIDA FUEROS 34 UBICADA EN C. P. REPUBLICA BRASIL,Bicipark Montalban,"Calle de Montalbán, 5",5327.57
21,Casa de Niños San Miguel,AVENIDA VIRGEN DEL CARMEN 32,Bicipark Fuente de la Mora,Estación de Fuente de la Mora,1465.1
22,Centro  de Educación Especial Colegio Gaudem,CALLE PLAYA DE BARLOVENTO 14,Bicipark Fuente de la Mora,Estación de Fuente de la Mora,5986.16
23,Centro Bobath de educación de adultos,CALLE MIRADOR DE LA REINA 115,Bicipark Pitis,"Calle Pau Arroyo del Fresno, 181",714.11
24,Centro Bobath de Formación Profesional,CALLE MIRADOR DE LA REINA 115,Bicipark Pitis,"Calle Pau Arroyo del Fresno, 181",714.11
25,Centro Cultural y Deportivo Tajamar,CALLE PIO FELIPE 12,Bicipark Montalban,"Calle de Montalbán, 5",4130.42
26,Centro de artes plásticas Kroom Dos Diseños,CALLE PILAR DE ZARAGOZA 104,Bicipark Salamanca,Pl. del Marqués de Salamanca,965.55
27,Centro de Danza Carmen Roche,CALLE COSLADA 7,Bicipark Salamanca,Pl. del Marqués de Salamanca,860.58
28,Centro de Educación Aviation and MAintenance Group,AVENIDA OROVILLA 10,Bicipark Canalejas,-,5700.76
29,Centro de Educación de Adultos Cen-Taller Norte Joven Villa de Vallecas,CALLE PEÑA VEIGA  sin número,Bicipark Montalban,"Calle de Montalbán, 5",7319.62
30,Centro de Educación de Personas Adultas (CEPA)  Cultural Moratalaz,CALLE CORREGIDOR ALONSO DE TOBAR 7,Bicipark Montalban,"Calle de Montalbán, 5",3852.51
31,Centro de Educación de Personas Adultas (CEPA) Aluche,CALLE OCA&amp;Ntilde;A 35,Bicipark Aviación,Parking Aviación Española,2439.62
32,Centro de Educación de Personas Adultas (CEPA) Arganzuela,CALLE BATALLA DEL SALADO 29,Bicipark Canalejas,-,1946.61
33,Centro de Educación de Personas Adultas (CEPA) Canillejas,CALLE MUSAS 11,Bicipark Salamanca,Pl. del Marqués de Salamanca,6049.72
34,Centro de Educación de Personas Adultas (CEPA) Cid Campeador,CALLE ANSELMO LORENZO 12,Bicipark Aviación,Parking Aviación Española,1120.24
35,Centro de Educación de Personas Adultas (CEPA) Ciudad Lineal,CALLE HERMANOS GARCIA NOBLEJAS 70,Bicipark Salamanca,Pl. del Marqués de Salamanca,3979.2
36,Centro de Educación de Personas Adultas (CEPA) Daoíz y Velarde,CALLE FERNANDO ORTIZ 2 PLANTA 2,Bicipark Canalejas,-,5627.25
37,Centro de Educación de Personas Adultas (CEPA) Distrito Centro,CALLE SAN BERNARDO 70 PLANTA 2,Bicipark Villa de Paris,"Calle de Orellana, 23, 21",1086.79
38,Centro de Educación de Personas Adultas (CEPA) Dulce Chacón,CALLE ABERTURA 2,Bicipark Fuente de la Mora,Estación de Fuente de la Mora,1409.8
39,Centro de Educación de Personas Adultas (CEPA) Entrevías,CALLE SERENA 394,Bicipark Montalban,"Calle de Montalbán, 5",4963.97
40,Centro de Educación de Personas Adultas (CEPA) Fuencarral,CALLE BRAILLE 10,Bicipark Pitis,"Calle Pau Arroyo del Fresno, 181",2651.98
41,Centro de Educación de Personas Adultas (CEPA) Hortaleza - Mar Amarillo,CALLE MAR AMARILLO 21,Bicipark Fuente de la Mora,Estación de Fuente de la Mora,2167.01
42,Centro de Educación de Personas Adultas (CEPA) Joaquín Sorolla,CALLE ALONSO HEREDIA 16,Bicipark Salamanca,Pl. del Marqués de Salamanca,776.0
43,Centro de Educación de Personas Adultas (CEPA) José Luis Sampedro,CALLE CHANTADA 34,Bicipark Pitis,"Calle Pau Arroyo del Fresno, 181",2694.78
44,Centro de Educación de Personas Adultas (CEPA) La Albufera,CALLE NUESTRA SEÑORA DEL PERPETUO SOCORRO 23,Bicipark Montalban,"Calle de Montalbán, 5",3682.21
45,Centro de Educación de Personas Adultas (CEPA) Las Rosas,CALLE ARCOS DE JALON 9,Bicipark Salamanca,Pl. del Marqués de Salamanca,4757.63
46,Centro de Educación de Personas Adultas (CEPA) Los Rosales,CALLE CONCEPCION DE LA OLIVA 17,Bicipark Montalban,"Calle de Montalbán, 5",7136.76
47,Centro de Educación de Personas Adultas (CEPA) Moncloa,CALLE JUAN ALVAREZ MENDIZABAL 20,Bicipark Canalejas,-,1545.71
48,Centro de Educación de Personas Adultas (CEPA) Oporto,AVENIDA OPORTO 46,Bicipark Canalejas,-,4116.89
49,Centro de Educación de Personas Adultas (CEPA) Orcasitas,CALLE OREJA 186,Bicipark Canalejas,-,5593.15
50,Centro de Educación de Personas Adultas (CEPA) Pablo Guzmán,CALLE ANDORRA 19,Bicipark Fuente de la Mora,Estación de Fuente de la Mora,2929.22
51,Centro de Educación de Personas Adultas (CEPA) Pan Bendito,CALLE CAMINO VIEJO DE LEGANES 188,Bicipark Aviación,Parking Aviación Española,4238.77
52,Centro de Educación de Personas Adultas (CEPA) Tetuán,CALLE PINOS ALTA 63,Bicipark Recuerdo,"Calle Hiedra, 26",1705.37
53,Centro de Educación de Personas Adultas (CEPA) Vallecas,PLAZA ANTONIO MARIA SEGOVIA ,Bicipark Montalban,"Calle de Montalbán, 5",7781.87
54,Centro de Educación de Personas Adultas (CEPA) Vicálvaro,CALLE LAGO COMO 4,Bicipark Salamanca,Pl. del Marqués de Salamanca,6928.79
55,Centro de Educación de Personas Adultas (CEPA) Villaverde,CALLE VILLALONSO 10,Bicipark Aviación,Parking Aviación Española,7395.26
56,Centro de Educación de Personas Adultas (CEPA) Vista Alegre,CALLE GENERAL RICARDOS 179,Bicipark Aviación,Parking Aviación Española,3986.53
57,Centro de Educación Especial  El Cole de Celia y Pepe,CALLE SOPELANA 5,Bicipark Pitis,"Calle Pau Arroyo del Fresno, 181",2790.65
58,Centro de Educación Especial A LA PAR,CALLE MONASTERIO DE LAS HUELGAS 15,Bicipark Pitis,"Calle Pau Arroyo del Fresno, 181",1658.63
59,Centro de Educación Especial Ademo,CALLE HACIENDA DE PAVONES 328,Bicipark Salamanca,Pl. del Marqués de Salamanca,4808.49
60,Centro de Educación Especial Aleph,CALLE CUEVA DE MONTESINOS 49,Bicipark Pitis,"Calle Pau Arroyo del Fresno, 181",2790.65
61,Centro de Educación Especial Araya,CALLE RAMON POWER 9,Bicipark Fuente de la Mora,Estación de Fuente de la Mora,3524.92
62,Centro de Educación Especial Atenpace,CALLE ISLAS MARQUESAS 27,Bicipark Pitis,"Calle Pau Arroyo del Fresno, 181",2180.95
63,Centro de Educación Especial Aucavi,CALLE RICARDO ORTIZ 29,Bicipark Salamanca,Pl. del Marqués de Salamanca,1834.62
64,Centro de Educación Especial Buenafuente,CALLE PROTASIO GOMEZ 5,Bicipark Salamanca,Pl. del Marqués de Salamanca,3628.51
65,Centro de Educación Especial Cambrils,AVENIDA POBLADOS 151,Bicipark Aviación,Parking Aviación Española,5168.17
66,Centro de Educación Especial Carmen Fernández Miranda FSDM,CALLE CAIDOS DE LA DIVISION AZUL 15,Bicipark Recuerdo,"Calle Hiedra, 26",806.45
67,Centro de Educación Especial Centro Bobath España,CALLE MIRADOR DE LA REINA 115,Bicipark Pitis,"Calle Pau Arroyo del Fresno, 181",709.7
68,Centro de Educación Especial Centro Educativo Ponce de León,CALLE EDUARDO BARREIROS 6,Bicipark Canalejas,-,5056.38
69,Centro de Educación Especial Centro Nuevo de Pedagogía,CALLE TAJO 6,Bicipark Orense,"Avenida General Perón, 27",1067.62
70,Centro de Educación Especial Cisen,CALLE VIRGEN DE ARANZAZU 5,Bicipark Recuerdo,"Calle Hiedra, 26",1798.67
71,Centro de Educación Especial C.R.E. Antonio Vicente Mosquete,AVENIDA DOCTOR GARCIA TAPIA (C/V A C/OBERÓN) 210,Bicipark Salamanca,Pl. del Marqués de Salamanca,2413.6
72,Centro de Educación Especial del Hospital Infantil de San Rafael,AVENIDA CONCHA ESPINA 32,Bicipark Orense,"Avenida General Perón, 27",1214.42
73,Centro de Educación Especial El Despertar,CALLE ADONIS 1,Bicipark Aviación,Parking Aviación Española,898.8
74,Centro de Educación Especial Estudio  3,CALLE TAPIA DE CASARIEGO 1,Bicipark Pitis,"Calle Pau Arroyo del Fresno, 181",5711.47
75,Centro de Educación Especial Fundación Gotze,CARRETERA CASTILLA 5,Bicipark Orense,"Avenida General Perón, 27",5840.51
76,Centro de Educación Especial Instituto Psicopediatría Doctor Quintero Lumbreras,CAMINO VALVERDE 76,Bicipark Pitis,"Calle Pau Arroyo del Fresno, 181",4296.94
77,Centro de Educación Especial Instituto San José,CALLE PINAR DE SAN JOSE 98,Bicipark Aviación,Parking Aviación Española,2494.53
78,Centro de Educación Especial Leo Kanner,CALLE PEÑA DEL SOL 22,Bicipark Pitis,"Calle Pau Arroyo del Fresno, 181",1996.26
79,Centro de Educación Especial Los Álamos,RONDA SUR 229,Bicipark Montalban,"Calle de Montalbán, 5",5420.76
80,Centro de Educación Especial María Corredentora,CALLE LUIS DE LA MATA 24,Bicipark Fuente de la Mora,Estación de Fuente de la Mora,5367.38
81,Centro de Educación Especial Nuestra Señora de las Victorias,CALLE MULLER 25,Bicipark Orense,"Avenida General Perón, 27",1316.65
82,Centro de Educación Especial Numen,CALLE TABATINGA 11,Bicipark Salamanca,Pl. del Marqués de Salamanca,4208.57
83,Centro de Educación Especial Peripatos,CALLE CLARISAS 16,Bicipark Canalejas,-,3873.31
84,Centro de Educación Especial Tao. Sociedad Cooperativa Limitada de Pedagogía Terapéutica,CALLE JOSE LUIS DE ARRESE 5,Bicipark Salamanca,Pl. del Marqués de Salamanca,2230.78
85,Centro de Educación Guzmán el Bueno II,CALLE PEZ VOLADOR 30 Real Canoe Natación Club,Bicipark Salamanca,Pl. del Marqués de Salamanca,2224.6
86,Centro de Educación Hazerta,CALLE DOCTOR GOMEZ ULLA 24,Bicipark Salamanca,Pl. del Marqués de Salamanca,1040.21
87,Centro de educación INAV FP,CALLE LA MASO 76,Bicipark Pitis,"Calle Pau Arroyo del Fresno, 181",1320.97
88,Centro de educación INAV FP II,CALLE ARROYO FONTARRON 209,Bicipark Montalban,"Calle de Montalbán, 5",4525.94
89,Centro de Educación Superior de Negocios Innovación y Tecnología IUNIT,CALLE ALFONSO RODRIGUEZ SANTAMARIA 19,Bicipark Orense,"Avenida General Perón, 27",841.09
90,Centro de enseñanza Acadef Atocha,CALLE CONDESA VEGA DEL POZO 28,Bicipark Salamanca,Pl. del Marqués de Salamanca,6945.76
91,Centro de enseñanza Acadef FP Arturo Soria,CALLE DUQUE DE TAMAMES 9,Bicipark Salamanca,Pl. del Marqués de Salamanca,3178.77
92,Centro de enseñanza Afuera I,PLAZA SANTA ANA 13,Bicipark Canalejas,-,411.76
93,Centro de enseñanza Campus Dental Madrid,CALLE COLOMBIA 53,Bicipark Recuerdo,"Calle Hiedra, 26",1842.33
94,Centro de enseñanza Campus FP Arturo Soria-Esatur,CALLE ASURA 40,Bicipark Recuerdo,"Calle Hiedra, 26",3157.08
95,Centro de enseñanza Campus FP Vistalegre Bid Data &amp; Cibersecurity Technology,CALLE ANTOLINA MERINO 10,Bicipark Aviación,Parking Aviación Española,3432.71
96,Centro de enseñanza CDP Albor Madrid,AVENIDA CARONDELET 35,Bicipark Salamanca,Pl. del Marqués de Salamanca,3982.61
97,Centro de enseñanza CESUR Madrid Plaza Elíptica,CALLE SANTA LUCRECIA 11,Bicipark Canalejas,-,3896.37
98,Centro de enseñanza Cesur Open,CALLE GAVIA SECA 15,Bicipark Montalban,"Calle de Montalbán, 5",7444.57
99,Centro de enseñanza CESUR - Madrid,CALLE LUIS CABRERA 63,Bicipark Salamanca,Pl. del Marqués de Salamanca,1666.75
100,Centro de enseñanza CESUR - Madrid II,CALLE ALBARRACIN 27,Bicipark Salamanca,Pl. del Marqués de Salamanca,3984.63
101,Centro de enseñanza CODESA,CALLE DIEGO DE LEON 34,Bicipark Salamanca,Pl. del Marqués de Salamanca,521.87
102,Centro de enseñanza Cruz Roja,CALLE DE RAFAEL VILLA ,Bicipark Pitis,"Calle Pau Arroyo del Fresno, 181",8518.61
103,Centro de enseñanza Cruz Roja Escuela Profesional,AVENIDA REINA VICTORIA 28,Bicipark Orense,"Avenida General Perón, 27",1480.74
104,Centro de enseñanza Edix,CALLE BRUNO ABUNDEZ 48,Bicipark Montalban,"Calle de Montalbán, 5",6506.46
105,Centro de enseñanza Edix II,CALLE VALDESQUI 16,Bicipark Pitis,"Calle Pau Arroyo del Fresno, 181",5227.79
106,Centro de enseñanza Feda Madrid,AVENIDA BURGOS 12,Bicipark Recuerdo,"Calle Hiedra, 26",309.82
107,Centro de enseñanza Formación Profesional Core Networks,AVENIDA MANOTERAS 32,Bicipark Fuente de la Mora,Estación de Fuente de la Mora,420.85
108,Centro de enseñanza Formación Profesional Gala,AVENIDA EJE CENTRAL 3,Bicipark Montalban,"Calle de Montalbán, 5",6641.49
109,Centro de enseñanza FP Madrid Aluche,AVENIDA POBLADOS 72,Bicipark Aviación,Parking Aviación Española,2380.25
110,Centro de enseñanza FP Madrid Villaverde,CALLE TRANSVERSAL SEXTA 17,Bicipark Aviación,Parking Aviación Española,9116.51
111,Centro de enseñanza FP SUMMA,CALLE CIDRO 7,Bicipark Aviación,Parking Aviación Española,3639.45
112,Centro de enseñanza G12 Madrid Adrián Pulido,CALLE ADRIAN PULIDO 7 y 9,Bicipark Orense,"Avenida General Perón, 27",1030.15
113,Centro de enseñanza ILERNA Madrid,CALLE JULIAN CAMARILLO 4,Bicipark Salamanca,Pl. del Marqués de Salamanca,3886.17
114,Centro de enseñanza Innovación en Formación Profesional,CALLE JULIAN CAMARILLO 6,Bicipark Salamanca,Pl. del Marqués de Salamanca,4059.29
115,Centro de enseñanza Innovación en Formación Profesional II,CALLE ALCALA 472,Bicipark Salamanca,Pl. del Marqués de Salamanca,4064.94
116,Centro de enseñanza Instede Caja Mágica,CAMINO PERALES ,Bicipark Montalban,"Calle de Montalbán, 5",5459.19
117,Centro de enseñanza Instede FP,PLAZA ELIPTICA 2,Bicipark Canalejas,-,3953.47
118,Centro de Enseñanza Liceo Consul,CALLE PEIRONCELY 7,Bicipark Montalban,"Calle de Montalbán, 5",4383.88
119,Centro de enseñanza Linkia FP Madrid,CALLE ALBARRACIN 34 Edificio A,Bicipark Salamanca,Pl. del Marqués de Salamanca,3954.39
120,Centro de enseñanza Magister,AVENIDA DOCTOR FEDERICO RUBIO Y GALI 1,Bicipark Orense,"Avenida General Perón, 27",1360.97
121,Centro de enseñanza Mom culinary institute,CALLE SERRANO 95,Bicipark Almagro,"Calle Almagro, 11",1014.67
122,Centro de enseñanza MOPE,PASEO GENERAL MARTINEZ CAMPOS 20,Bicipark Almagro,"Calle Almagro, 11",545.69
123,Centro de Enseñanza Pablo VI. Instituto Católico de Estudios (ICE),CALLE BRAVO MURILLO 297,Bicipark Orense,"Avenida General Perón, 27",1026.58
124,Centro de Enseñanza Superior Cardenal Cisneros,CALLE GENERAL DIAZ PORLIER 58,Bicipark Salamanca,Pl. del Marqués de Salamanca,217.21
125,Centro de Enseñanza Superior en Humanidades y Ciencias de la Educación Don Bosco,CALLE MARIA AUXILIADORA 9,Bicipark Orense,"Avenida General Perón, 27",1899.16
126,Centro de Enseñanza Superior Villanueva,CALLE COSTA BRAVA 2 y 6,Bicipark Pitis,"Calle Pau Arroyo del Fresno, 181",1933.5
127,Centro de enseñanza Unyversia Acadef FP,CALLE CANARIAS 3 y 5,Bicipark Canalejas,-,1745.14
128,Centro de enseñanza Upgrade HUB,CALLE VALORES 1,Bicipark Montalban,"Calle de Montalbán, 5",1966.66
129,Centro de enseñanza Vicente Moya Pueyo,AVENIDA MONCLOA 18,Bicipark Orense,"Avenida General Perón, 27",2131.34
130,Centro de enseñanza Virtus Educando San José Hijas de María,CALLE MARQUES DE VIANA 43 y 45,Bicipark Orense,"Avenida General Perón, 27",1217.98
131,Centro de Enseñanza Workshop Experience Group,CALLE ALCALA 182,Bicipark Salamanca,Pl. del Marqués de Salamanca,1160.64
132,Centro de Estudios Castilla,CALLE OSO 23,Bicipark Canalejas,-,1063.25
133,Centro de Estudios Díaz-Balaguer,CALLE FERNANDO EL CATOLICO 77,Bicipark Almagro,"Calle Almagro, 11",2124.7
134,"Centro de estudios Digitech, Centro de Tecnología y Digitalización",CALLE LUIS DE SALAZAR 9,Bicipark Salamanca,Pl. del Marqués de Salamanca,2219.3
135,Centro de Estudios Financieros,CALLE VIRIATO 52,Bicipark Almagro,"Calle Almagro, 11",704.95
136,Centro de Estudios González Cañadas,CALLE FUENCARRAL 95,Bicipark Villa de Paris,"Calle de Orellana, 23, 21",698.0
137,Centro de Estudios Judeo - Cristianos,CALLE HILARION ESLAVA 50 PLANTA 6 Izquierda,Bicipark Almagro,"Calle Almagro, 11",2131.92
138,Centro de estudios musicales La Mennais,AVENIDA BRASILIA 11,Bicipark Salamanca,Pl. del Marqués de Salamanca,1744.65
139,Centro de estudios profesionales Almagro,CALLE ALMAGRO 25,Bicipark Almagro,"Calle Almagro, 11",135.28
140,Centro de estudios profesionales Cesur Amorós,CALLE JOAQUIN TURINA 37,Bicipark Aviación,Parking Aviación Española,2771.19
141,Centro de estudios profesionales de la Universidad Camilo José Cela. Centro Ferraz,CALLE QUINTANA 21,Bicipark Canalejas,-,1932.02
142,Centro de estudios superiores profesionales IMF,CALLE BERNARDINO OBREGON 25,Bicipark Canalejas,-,1730.8
143,Centro de formación dinámica,CALLE BABILONIA 19,Bicipark Fuente de la Mora,Estación de Fuente de la Mora,6609.81
144,Centro de Formación Profesional Aspasia y las Mercedes,CALLE MERCEDES 19,Bicipark Orense,"Avenida General Perón, 27",625.07
145,Centro de formación profesional CCC,CALLE ALBASANZ 9,Bicipark Salamanca,Pl. del Marqués de Salamanca,4171.73
146,Centro de formación profesional CCC II,CALLE ALBASANZ 12,Bicipark Salamanca,Pl. del Marqués de Salamanca,3957.0
147,Centro de formación profesional CCC III,CALLE SAN SOTERO 3,Bicipark Salamanca,Pl. del Marqués de Salamanca,4839.16
148,Centro de formación profesional ESSAE,CALLE ISABEL COLBRAND 6,Bicipark Fuente de la Mora,Estación de Fuente de la Mora,3294.58
149,Centro de formación profesional Euroformac FP,AVENIDA PABLO IGLESIAS 53,Bicipark Orense,"Avenida General Perón, 27",1457.37
150,Centro de Formación Profesional Fundación Laboral de la Construcción Madrid,CALLE RIVAS 25,Bicipark Salamanca,Pl. del Marqués de Salamanca,8724.12
151,Centro de Formación Profesional José Ramón Otero,CALLE FRANCISCO BRIZUELA 3,Bicipark Canalejas,-,3459.86
152,Centro de Formación Profesional Lider System FP Madrid Río,AVENIDA EMPERATRIZ ISABEL 5,Bicipark Canalejas,-,2674.93
153,Centro de formación profesional Madrid EEP,CALLE TORRELAGUNA 123,Bicipark Recuerdo,"Calle Hiedra, 26",2671.05
154,Centro de formación profesional Voxel School,CALLE VASCOS 25,Bicipark Orense,"Avenida General Perón, 27",1548.53
155,Centro de Formación Técnica,CALLE CARRETAS 14,Bicipark Canalejas,-,459.88
156,Centro de Formación Vértice,CALLE MAGALLANES 1,Bicipark Almagro,"Calle Almagro, 11",1082.93
157,Centro de Formación Profesional C.I.F.P. Profesor Raul Vazquez,CARRETERA VILLAVERDE A VALLECAS KM 4 ,Bicipark Montalban,"Calle de Montalbán, 5",7151.46
158,Centro de música Nuestra Señora de Loreto.,CALLE PRINCIPE DE VERGARA 42,Bicipark Salamanca,Pl. del Marqués de Salamanca,251.09
159,Centro de música Tempo Musical,CALLE RAMON DE AGUINAGA 15,Bicipark Salamanca,Pl. del Marqués de Salamanca,1480.18
160,Centro de música y danza Música Creativa,CALLE PALMA 35,Bicipark Villa de Paris,"Calle de Orellana, 23, 21",913.36
161,Centro de Recursos para la Comunidad Sorda Juan Luis Marroquín,CALLE ISLAS ALEUTIANAS 28,Bicipark Pitis,"Calle Pau Arroyo del Fresno, 181",2058.72
162,Centro Educativo Global College,CALLE CASTELLON DE LA PLANA 8,Bicipark Salamanca,Pl. del Marqués de Salamanca,1169.38
163,Centro Educativo Ponce de León,CALLE EDUARDO BARREIROS 6,Bicipark Canalejas,-,5056.38
164,Centro educativo-terapéutico Norte,CALLE VIRGEN DE ARANZAZU 5,Bicipark Recuerdo,"Calle Hiedra, 26",1798.11
165,Centro educativo-terapéutico Pradera de San Isidro,CALLE GORRION 2,Bicipark Canalejas,-,3388.17
166,Centro educativo-terapéutico Vallecas,CALLE QUIJORNA s/n,Bicipark Montalban,"Calle de Montalbán, 5",8006.28
167,Centro Español de Nuevas Profesiones,CALLE JOAQUIN MARIA LOPEZ 60,Bicipark Almagro,"Calle Almagro, 11",2124.54
168,Centro Estudios Musicales Pinzón,CALLE HALCON 11,Bicipark Aviación,Parking Aviación Española,3542.56
169,Centro Europeo de Estudios Profesionales,PASEO EXTREMADURA 33,Bicipark Canalejas,-,2534.06
170,Centro Extranjero La Estrella del Pez Luna,AVENIDA CASA QUEMADA 5,Bicipark Pitis,"Calle Pau Arroyo del Fresno, 181",9576.35
171,Centro Integrado de Enseñanzas Artísticas de Música y Educación Secundaria Federico Moreno Torroba,CALLE GENERAL RICARDOS 177,Bicipark Aviación,Parking Aviación Española,4001.9
172,Centro integrado de enseñanzas regladas a distancia,PASEO PRADO 28,Bicipark Montalban,"Calle de Montalbán, 5",727.62
173,Centro Mesena,CALLE EMETERIO CASTA&amp;Ntilde;OS 11,Bicipark Recuerdo,"Calle Hiedra, 26",1732.73
174,Centro Municipal de Educación de Adultos. Distrito Arganzuela.,PASEO CHOPERA 10 Casa del Reloj,Bicipark Canalejas,-,2716.4
175,Centro Municipal de Educación de Adultos. Distrito Barajas.,CALLE PLUS ULTRA 3,Bicipark Fuente de la Mora,Estación de Fuente de la Mora,6730.51
176,Centro Municipal de Educación de Adultos. Distrito Moncloa - Aravaca. Avenida Valladolid,AVENIDA VALLADOLID 2 En  Colegio Público  Fernández de Moratín,Bicipark Canalejas,-,2558.62
177,Centro Municipal de Educación de Adultos. Distrito Moncloa - Aravaca. Calle Francos Rodríguez,CALLE FRANCOS RODRIGUEZ 77,Bicipark Orense,"Avenida General Perón, 27",1920.69
178,"Centro Pauta, Centro de día",CALLE POBLADURA DEL VALLE 13,Bicipark Salamanca,Pl. del Marqués de Salamanca,5159.84
179,"Centro Politécnico a distancia y Editorial CPD, SL",CALLE SANGENJO 34,Bicipark Recuerdo,"Calle Hiedra, 26",2310.44
180,Centro Privado de Educación de Personas Adultas CICA,CALLE EDUARDO RIVAS 10,Bicipark Canalejas,-,3294.28
181,"Centro Privado de Educación de Personas Adultas Educación, cultura y solidaridad",CALLE PATERNA 49,Bicipark Montalban,"Calle de Montalbán, 5",8597.72
182,Centro Privado de Educación de Personas Adultas Escuela Popular de Prosperidad,CALLE LUIS CABRERA 19,Bicipark Salamanca,Pl. del Marqués de Salamanca,1337.59
183,Centro Privado de Educación de Personas Adultas INAV,CALLE JOSE ABASCAL 55,Bicipark Almagro,"Calle Almagro, 11",886.71
184,Centro Privado de Educación de Personas Adultas Nazaret,CALLE CUART DE POBLET 6,Bicipark Aviación,Parking Aviación Española,3097.97
185,Centro Privado de Educación de Personas Adultas Practivox,CALLE ATOCHA 93,Bicipark Canalejas,-,792.98
186,Centro Privado de Formación Profesional Específica CENP - FP,CALLE JOAQUIN MARIA LOPEZ 60 BIS,Bicipark Almagro,"Calle Almagro, 11",2124.62
187,Centro Privado de Formación Profesional Instituto Vox,CALLE GUZMAN EL BUENO 115,Bicipark Almagro,"Calle Almagro, 11",2044.53
188,Centro Regional Enseñanzas Integradas Sagrado Corazón de Jesús,CAMINO CARRETERA DE EL PARDO A COLMENAR VIEJO KM.13500,Bicipark Pitis,"Calle Pau Arroyo del Fresno, 181",4539.73
189,Centro Sociocultural Clara Campoamor (Retiro),PLAZA DAOIZ Y VELARDE 2 PLANTA 1ª,Bicipark Montalban,"Calle de Montalbán, 5",2110.64
190,Centro Sociocultural Santa Petronila (Villaverde),CALLE MARIA MARTINEZ OVIOL 12,Bicipark Canalejas,-,7473.34
191,Centro Superior CEAC de Formación Profesional,PLAZA CRONOS 1,Bicipark Salamanca,Pl. del Marqués de Salamanca,5194.46
192,Centro Superior de Arte Dramático Scaena,CALLE COSLADA 7 BIS,Bicipark Salamanca,Pl. del Marqués de Salamanca,860.58
193,Centro Superior de Diseño y Arte Digital,CALLE MAR ADRIATICO 11,Bicipark Fuente de la Mora,Estación de Fuente de la Mora,2393.17
194,Centro Superior de Diseño y Moda de Madrid,CARRETERA VALENCIA 7 Bloque I,Bicipark Montalban,"Calle de Montalbán, 5",6187.6
195,Centro Superior de Enseñanza Musical Katarina Gurska,CALLE SANTA ENGRACIA 1,Bicipark Villa de Paris,"Calle de Orellana, 23, 21",349.49
196,Centro superior de enseñanza musical Progreso Musical,CALLE TUTOR 52,Bicipark Almagro,"Calle Almagro, 11",2119.53
197,Centro Superior de Estudios Universitarios La Salle,CALLE LA SALLE 10,Bicipark Pitis,"Calle Pau Arroyo del Fresno, 181",5848.76
198,Centro Superior de Hostelería del Mediterráneo,PASEO ERMITA DEL SANTO 48,Bicipark Canalejas,-,2436.04
199,Centro superior de innovación y desarrollo CHF,CALLE PIRINEOS 55,Bicipark Orense,"Avenida General Perón, 27",2101.18
200,Centro Superior Música Creativa,CALLE PALMA 35,Bicipark Villa de Paris,"Calle de Orellana, 23, 21",913.36
201,Cerem International Business School,CALLE CEDACEROS 11,Bicipark Canalejas,-,142.75
202,CES Centro Especializado en Superdotados,CALLE VELAZQUEZ 126 PLANTA 3 D,Bicipark Salamanca,Pl. del Marqués de Salamanca,812.99
