,place,place_address,station_name,station_address,distance
898,Escuela de Música de Grado Elemental Calasanz,CALLE CONDE DE PE&amp;Ntilde;ALVER 51,Bicipark Salamanca,Pl. del Marqués de Salamanca,330.18
899,Escuela de Música Intermezzo,CALLE MENDEZ ALVARO 2,Bicipark Montalban,"Calle de Montalbán, 5",1254.63
900,Escuela de Música Katarina Gurska,CALLE GENIL 13,Bicipark Orense,"Avenida General Perón, 27",1181.37
901,Escuela de Música Mater Salvatoris,CALLE VALDESQUI 4,Bicipark Pitis,"Calle Pau Arroyo del Fresno, 181",5290.44
902,Escuela de música Musical Marisa,CALLE ALCALA 126,Bicipark Salamanca,Pl. del Marqués de Salamanca,766.1
903,Escuela de música Musical Marti,CALLE FERMIN CABALLERO 53,Bicipark Pitis,"Calle Pau Arroyo del Fresno, 181",2043.93
904,Escuela de música Musical Silvela,CALLE FRANCISCO SILVELA 7,Bicipark Salamanca,Pl. del Marqués de Salamanca,802.91
905,Escuela de música Musiclaret Innovación Musical,CALLE CORAZON DE MARIA 1,Bicipark Salamanca,Pl. del Marqués de Salamanca,1270.42
906,Escuela de Música Progreso Musical,CALLE TUTOR 52,Bicipark Almagro,"Calle Almagro, 11",2119.53
907,Escuela de Música Santa Cecilia,CALLE VIVERO 4,Bicipark Orense,"Avenida General Perón, 27",1487.11
908,Escuela de Música Serra,CALLE ESCALONA 61,Bicipark Aviación,Parking Aviación Española,2343.06
909,Escuela de Música Sigfredo,CALLE PORVENIR 9,Bicipark Salamanca,Pl. del Marqués de Salamanca,1298.59
910,Escuela de Música Soto Mesa,CALLE SANTA CRUZ DE MARCENADO 1,Bicipark Villa de Paris,"Calle de Orellana, 23, 21",1163.74
911,Escuela de Música y Danza Arenales,AVENIDA POBLADOS 151,Bicipark Aviación,Parking Aviación Española,5169.48
912,Escuela de Práctica Jurídica,CALLE AMANIEL 2,Bicipark Canalejas,-,1147.47
913,Escuela de Tiempo Libre Abancay,CALLE ISLAS CIES 22 PLANTA Bajo C,Bicipark Pitis,"Calle Pau Arroyo del Fresno, 181",1805.08
914,Escuela de Tiempo Libre Acaya,CALLE CONSTANCIA 39,Bicipark Salamanca,Pl. del Marqués de Salamanca,1515.02
915,Escuela de Tiempo Libre Acrescere,AVENIDA OSA MAYOR 19 PLANTA BAJO 1,Bicipark Pitis,"Calle Pau Arroyo del Fresno, 181",6040.12
916,Escuela de Tiempo Libre Actúa,CALLE VALDEBERNARDO 26 entrada por calle Luis de Hoyos Sainz,Bicipark Salamanca,Pl. del Marqués de Salamanca,5063.11
917,Escuela de Tiempo Libre Arci-Nature,CALLE TENIENTE MU&amp;Ntilde;OZ DIAZ 5,Bicipark Montalban,"Calle de Montalbán, 5",4081.38
918,Escuela de Tiempo Libre Arpa4,CALLE ISABEL COLBRAND 10 PLANTA 5 Oficina 151,Bicipark Fuente de la Mora,Estación de Fuente de la Mora,3201.27
919,Escuela de Tiempo Libre ASDE - Insignia de Madera,CALLE HORTALEZA 19 PLANTA 1 Izquierda,Bicipark Canalejas,-,427.24
920,Escuela de Tiempo Libre Aula Joven,CALLE EUGENIO SALAZAR 53,Bicipark Orense,"Avenida General Perón, 27",1637.16
921,Escuela de Tiempo Libre Ceam,CALLE CERRO DEL MURMULLO 13 PLANTA 2 Oficina 181,Bicipark Montalban,"Calle de Montalbán, 5",10851.43
922,Escuela de Tiempo Libre Censa,CALLE MARQUES DE LA VALDAVIA 2 PLANTA 2,Bicipark Canalejas,-,1308.82
923,Escuela de Tiempo Libre Coeduca,CALLE VELÁZQUEZ 15 PLANTA 1,Bicipark Recoletos,"Paseo de Recoletos, 2",702.59
924,Escuela de Tiempo Libre Cáritas de Madrid,CALLE SANTA HORTENSIA 3,Bicipark Salamanca,Pl. del Marqués de Salamanca,1878.76
925,Escuela de Tiempo Libre Don Bosco,CALLE MARÍA AUXILIADORA 9,Bicipark Orense,"Avenida General Perón, 27",1899.05
926,Escuela de Tiempo Libre Ealyr,CALLE MARTIN FIERRO 7,Bicipark Almagro,"Calle Almagro, 11",3467.0
927,Escuela de Tiempo Libre Educadores de Vallecas,CALLE JAVIER DE MIGUEL 92 PLANTA 2 local 5,Bicipark Montalban,"Calle de Montalbán, 5",4654.45
928,Escuela de Tiempo Libre Eduma,CALLE ALCÁNTARA 34 PLANTA Bajo H,Bicipark Salamanca,Pl. del Marqués de Salamanca,487.5
929,Escuela de Tiempo Libre Escuni,AVENIDA NUESTRA SEÑORA DE FÁTIMA 102,Bicipark Aviación,Parking Aviación Española,3003.7
930,Escuela de Tiempo Libre Francisco Giner de los Ríos,PASEO GENERAL MARTINEZ CAMPOS 14,Bicipark Almagro,"Calle Almagro, 11",602.46
931,Escuela de Tiempo Libre Gredos San Diego,CALLE JOSE GUTIERREZ MAROTO 26 PLANTA 1 B,Bicipark Montalban,"Calle de Montalbán, 5",9389.95
932,Escuela de Tiempo Libre Ideotur,CALLE ALCALÁ 104 PLANTA 2 A,Bicipark Salamanca,Pl. del Marqués de Salamanca,697.36
933,Escuela de Tiempo Libre Intercamp,CALLE FERRAZ 55 PLANTA 5,Bicipark Canalejas,-,2292.44
934,Escuela de Tiempo Libre ISE-JCMadrid,CALLE OCA&amp;Ntilde;A 14,Bicipark Aviación,Parking Aviación Española,2478.37
935,Escuela de Tiempo Libre Jeímaros,CALLE ALMANSA 15 PLANTA 1 D,Bicipark Orense,"Avenida General Perón, 27",1054.04
936,Escuela de Tiempo Libre Jumavi,CALLE JOSÉ ABASCAL 30,Bicipark Almagro,"Calle Almagro, 11",938.21
937,Escuela de Tiempo Libre La Escalera,CALLE ANDRÉS MELLADO 31 Local 19,Bicipark Almagro,"Calle Almagro, 11",1872.63
938,Escuela de Tiempo Libre La Frontera,PLAZA TUBILLA 7 -8 posterior,Bicipark Fuente de la Mora,Estación de Fuente de la Mora,1961.17
939,Escuela de Tiempo Libre Magni,CALLE HUMANES 3 Local 1,Bicipark Montalban,"Calle de Montalbán, 5",4329.57
940,Escuela de Tiempo Libre Masi,CALLE VIA CARPETANA 180 LOCAL,Bicipark Canalejas,-,3878.42
941,Escuela de Tiempo Libre Mirabilia,CALLE GRAN VIA 46 PLANTA 11 C,Bicipark Canalejas,-,621.13
942,Escuela de Tiempo Libre Nuestra Señora del Recuerdo,PLAZA DUQUE DE PASTRANA 5,Bicipark Recuerdo,"Calle Hiedra, 26",441.65
943,Escuela de Tiempo Libre Padre Carlos,CALLE VIRGEN DEL VAL 1,Bicipark Salamanca,Pl. del Marqués de Salamanca,2119.29
944,Escuela de Tiempo Libre Peñas Blancas,AVENIDA PORTUGAL 99 Local izquierda,Bicipark Canalejas,-,2084.05
945,Escuela de Tiempo Libre Santa Bárbara,PLAZA PAJA 4,Bicipark Canalejas,-,1163.92
946,Escuela de Tiempo Libre Scouts de Madrid MSC,CALLE ENTRE ARROYOS 19 BIS,Bicipark Salamanca,Pl. del Marqués de Salamanca,3190.05
947,Escuela de Tiempo Libre Shema,CALLE GENERAL RICARDOS 21 PLANTA Bajo C,Bicipark Canalejas,-,2849.77
948,Escuela de Tiempo Libre Skholé,CALLE ESCALONA 59 Colegio Santa Gema,Bicipark Aviación,Parking Aviación Española,2446.34
949,Escuela de Tiempo Libre YMCA,CALLE ALBA DE TORMES 10,Bicipark Aviación,Parking Aviación Española,3433.69
950,Escuela Diplomática,PASEO JUAN XXIII 5,Bicipark Orense,"Avenida General Perón, 27",2256.49
951,Escuela Ideo,CARRETERA COLMENAR VIEJO 16,Bicipark Fuente de la Mora,Estación de Fuente de la Mora,
952,Escuela Infantil  Alaria Aravaca Nursery School,CALLE BARRIAL 7,Bicipark Pitis,"Calle Pau Arroyo del Fresno, 181",6849.05
953,Escuela Infantil  Alaria Serrano Nursery School,CALLE SERRANO 212,Bicipark Orense,"Avenida General Perón, 27",1070.29
954,Escuela Infantil  Allegra,CALLE HIDRA 3,Bicipark Pitis,"Calle Pau Arroyo del Fresno, 181",5985.3
955,Escuela Infantil  Arco Iris,CALLE DIEGO OLIVERA VICTORIO 10,Bicipark Montalban,"Calle de Montalbán, 5",7594.45
956,Escuela Infantil  Aula Segre 3,CALLE SEGRE 3,Bicipark Orense,"Avenida General Perón, 27",981.54
957,Escuela Infantil  Bambi,PASEO GINEBRA 51,Bicipark Salamanca,Pl. del Marqués de Salamanca,6661.81
958,Escuela Infantil  Barcos de Papel,CALLE JOSE ESCOBAR Y SALIENTE 41,Bicipark Salamanca,Pl. del Marqués de Salamanca,10189.43
959,Escuela Infantil  Bliss Nursery School,CALLE MARIA DE MAEZTU 52,Bicipark Pitis,"Calle Pau Arroyo del Fresno, 181",631.74
960,Escuela Infantil  Chiquitin Pinar de Chamartin,CALLE GOLFO DE SALONICA 73,Bicipark Fuente de la Mora,Estación de Fuente de la Mora,358.23
961,Escuela Infantil  Colegio Internacional Arturo Soria Nursery School,CALLE LIDO 17,Bicipark Recuerdo,"Calle Hiedra, 26",2824.25
962,Escuela Infantil  Cuentacuentos 2,CALLE LA CENICIENTA 13,Bicipark Montalban,"Calle de Montalbán, 5",5156.93
963,Escuela Infantil  Duendecillos Lets Play,CALLE RAVENA 3,Bicipark Salamanca,Pl. del Marqués de Salamanca,5242.83
964,Escuela Infantil  El Tren de la Fresa,CALLE RAMIREZ DE PRADO 6,Bicipark Montalban,"Calle de Montalbán, 5",2114.42
965,Escuela Infantil  Estrella Infantil III,CALLE RAFAEL SALAZAR ALONSO (locales 19-22) 17,Bicipark Salamanca,Pl. del Marqués de Salamanca,1916.62
966,Escuela Infantil  La Isla,CALLE AZUL 25,Bicipark Fuente de la Mora,Estación de Fuente de la Mora,1850.17
967,Escuela Infantil  Little Artists,CALLE ESCUELA DE VALLECAS 12,Bicipark Montalban,"Calle de Montalbán, 5",10799.44
968,Escuela Infantil  Lysmon. Clara del Rey,CALLE CORAZON DE MARIA 64,Bicipark Salamanca,Pl. del Marqués de Salamanca,2091.75
969,Escuela Infantil  Montessori Village Piovera,CALLE SOTILLO 1,Bicipark Fuente de la Mora,Estación de Fuente de la Mora,3895.66
970,Escuela Infantil  My Little Planet Nursery School,CALLE AZOFRA 1,Bicipark Fuente de la Mora,Estación de Fuente de la Mora,1904.83
971,Escuela Infantil  Nemomarlin Barajas,CALLE PLAYA DE ARO (locales 1 y 2) 5,Bicipark Fuente de la Mora,Estación de Fuente de la Mora,6323.37
972,Escuela Infantil  Nido (Alemán),CALLE LUIS MURIEL 6,Bicipark Orense,"Avenida General Perón, 27",683.46
973,Escuela Infantil  Patuco 2,CALLE CASTILLEJOS 26,Bicipark Orense,"Avenida General Perón, 27",1156.38
974,Escuela Infantil  Pequeños Gigantes,AVENIDA SANTUARIO DE VALVERDE 54,Bicipark Pitis,"Calle Pau Arroyo del Fresno, 181",2516.65
975,Escuela Infantil  Peques,CALLE MONTES DE BARBANZA 5,Bicipark Montalban,"Calle de Montalbán, 5",7554.22
976,Escuela Infantil  Piecitos,CALLE JACOBEO 46,Bicipark Aviación,Parking Aviación Española,2708.2
977,Escuela Infantil  Pizcas,CALLE GENERAL CABRERA 23,Bicipark Orense,"Avenida General Perón, 27",349.64
978,Escuela Infantil  Planeta Enano Niño Jesús,AVENIDA MENENDEZ PELAYO 65,Bicipark Montalban,"Calle de Montalbán, 5",1262.48
979,Escuela Infantil  Ramón y Cajal. Calle López de Hoyos,CALLE LOPEZ DE HOYOS 386,Bicipark Recuerdo,"Calle Hiedra, 26",2098.92
980,Escuela Infantil  Santander España,CALLE JUAN IGNACIO LUCA DE TENA 11,Bicipark Salamanca,Pl. del Marqués de Salamanca,4302.47
981,Escuela Infantil  Valdebebitos,AVENIDA MANUEL FRAGA IRIBARNE 35,Bicipark Fuente de la Mora,Estación de Fuente de la Mora,4608.71
982,Escuela Infantil  Vickie,CALLE FRANCISCO LAGUNA 17,Bicipark Montalban,"Calle de Montalbán, 5",3461.11
983,Escuela Infantil  Yaki,AVENIDA RAMON Y CAJAL 49,Bicipark Orense,"Avenida General Perón, 27",1964.81
984,Escuela Infantil ABC Go Nurseries Julián Camarillo,CALLE ALFONSO GOMEZ 30,Bicipark Salamanca,Pl. del Marqués de Salamanca,4431.68
985,Escuela Infantil Acuarela,CALLE VILLA DE MARIN 29,Bicipark Recuerdo,"Calle Hiedra, 26",1820.68
986,Escuela Infantil Adela Abrines Castaños,CALLE GARROVILLAS 4,Bicipark Aviación,Parking Aviación Española,539.77
987,Escuela Infantil Agarimo,CALLE FERNANDO EL CATOLICO 61,Bicipark Almagro,"Calle Almagro, 11",1911.11
988,Escuela Infantil Airbus Astrium Barajas,AVENIDA ARAGON 404,Bicipark Fuente de la Mora,Estación de Fuente de la Mora,11290.77
989,Escuela Infantil Alaria Bernabéu Nursery School,CALLE JARAMA 9,Bicipark Orense,"Avenida General Perón, 27",950.48
990,Escuela Infantil Albeniz 2,CALLE OCAÑA 112,Bicipark Aviación,Parking Aviación Española,2721.01
991,Escuela Infantil Alcalá 540,CALLE ALCALA 540,Bicipark Salamanca,Pl. del Marqués de Salamanca,5239.52
992,Escuela Infantil Alegre Koala,CALLE ARGANDA 32,Bicipark Canalejas,-,2120.42
993,Escuela Infantil Alemana Kinderparadies,CALLE PEÑA PINTADA 13,Bicipark Pitis,"Calle Pau Arroyo del Fresno, 181",1909.01
994,Escuela Infantil Alfar,CALLE GERARDO DIEGO 15,Bicipark Montalban,"Calle de Montalbán, 5",5405.69
995,Escuela Infantil Alfonso X,CALLE DARIO GAZAPO 8,Bicipark Aviación,Parking Aviación Española,922.71
996,Escuela Infantil Alfredo López,CALLE VILLAESCUSA 50,Bicipark Salamanca,Pl. del Marqués de Salamanca,4225.47
997,Escuela Infantil Alicia,CALLE FERRAZ 60,Bicipark Canalejas,-,1994.47
998,Escuela Infantil Alicia II,CALLE BENITO GUTIERREZ 27,Bicipark Canalejas,-,2286.13
999,Escuela Infantil Alzando el Vuelo,CALLE MONASTERIO DE EL PAULAR 79,Bicipark Pitis,"Calle Pau Arroyo del Fresno, 181",2220.94
1000,Escuela Infantil Amadeo Vives,CALLE YEBENES 6 UBICADA EN C. P. AMADEO VIVES,Bicipark Aviación,Parking Aviación Española,2854.78
1001,Escuela Infantil Andal,CALLE ANTONIO DIAZ-CAÑABATE 18,Bicipark Montalban,"Calle de Montalbán, 5",1870.36
1002,Escuela Infantil Andal Alameda,PLAZA NAVIO 1,Bicipark Fuente de la Mora,Estación de Fuente de la Mora,7073.44
1003,Escuela Infantil Andal I,CALLE FRANCISCO VITORIA 4,Bicipark Montalban,"Calle de Montalbán, 5",1795.93
1004,Escuela Infantil Andal II,CALLE FRANCISCO VITORIA 21,Bicipark Montalban,"Calle de Montalbán, 5",1940.6
1005,Escuela Infantil Angelitos de Nerey,CALLE JOSE LUIS DE ARRESE 38,Bicipark Salamanca,Pl. del Marqués de Salamanca,2522.52
1006,Escuela Infantil Arce,CALLE ALCALDE GARRIDO JUARISTI 6,Bicipark Salamanca,Pl. del Marqués de Salamanca,2628.25
1007,Escuela Infantil Arco  Iris,PLAZA CORREGIDOR SANCHO DE CORDOBA 3,Bicipark Salamanca,Pl. del Marqués de Salamanca,3330.99
1008,Escuela Infantil Arienbaby,CALLE CAROLINA PAINO 24,Bicipark Aviación,Parking Aviación Española,3494.14
1009,Escuela Infantil Arlequín,CALLE YEBENES 69,Bicipark Aviación,Parking Aviación Española,2912.08
1010,Escuela Infantil Armonía,CALLE ISLA DE CUBA 12,Bicipark Fuente de la Mora,Estación de Fuente de la Mora,5754.25
1011,Escuela Infantil A.E.I.O.U.,CALLE YEBENES 92,Bicipark Aviación,Parking Aviación Española,2761.97
1012,Escuela Infantil Babilín II,CALLE ALMAZAN 2,Bicipark Canalejas,-,3896.07
1013,Escuela Infantil Bambi,CALLE SULFATO 9,Bicipark Aviación,Parking Aviación Española,7134.87
1014,Escuela Infantil Bambi y Tambor,CALLE LITUANIA 2,Bicipark Montalban,"Calle de Montalbán, 5",2599.79
1015,Escuela Infantil Bambinos,CALLE CONCEJAL FRANCISCO JOSE JIMENEZ MARTIN 142,Bicipark Aviación,Parking Aviación Española,3446.27
1016,Escuela Infantil Bambis,CALLE PICO DE MONTANCHEZ 12,Bicipark Montalban,"Calle de Montalbán, 5",7452.44
1017,Escuela Infantil Bamby. Calle Mingorria,CALLE MINGORRIA 16,Bicipark Aviación,Parking Aviación Española,1109.65
1018,Escuela Infantil Benjamines,PLAZA PLATON 1,Bicipark Salamanca,Pl. del Marqués de Salamanca,2646.86
1019,Escuela Infantil Bërbel Inhelder,CALLE ERASMO DE ROTTERDAM 6,Bicipark Pitis,"Calle Pau Arroyo del Fresno, 181",6385.02
1020,Escuela Infantil Betaria,CALLE PADRE RUBIO 14,Bicipark Recuerdo,"Calle Hiedra, 26",1132.0
1021,Escuela Infantil Bichejos-Sanchinarro,CALLE OÑA 137,Bicipark Fuente de la Mora,Estación de Fuente de la Mora,388.45
1022,Escuela Infantil Blancanitos 2,CALLE NAVES 13,Bicipark Canalejas,-,2201.79
1023,Escuela Infantil Bolboreta,CALLE HALCON 30,Bicipark Aviación,Parking Aviación Española,3490.82
1024,Escuela Infantil Borja,RONDA SUR 239,Bicipark Montalban,"Calle de Montalbán, 5",5360.31
1025,Escuela Infantil Brains Madrid,AVENIDA TOREROS 9,Bicipark Salamanca,Pl. del Marqués de Salamanca,782.2
1026,Escuela Infantil Británica  Dallington Infants,RONDA SOBRADIEL 20,Bicipark Recuerdo,"Calle Hiedra, 26",3869.89
1027,Escuela Infantil Buen Bebé,CALLE PIO BAROJA 2,Bicipark Montalban,"Calle de Montalbán, 5",1397.2
1028,Escuela Infantil Buen Consejo,CALLE HIENDELAENCINA 10 COLONIA CAMARINES,Bicipark Pitis,"Calle Pau Arroyo del Fresno, 181",5455.47
1029,Escuela Infantil Bularas INIA,"AVENIDA PADRE HUIDOBRO (CARRETERA CORUÑA KM 7,5)",Bicipark Fuente de la Mora,Estación de Fuente de la Mora,
1030,Escuela Infantil B.B. VIP,CALLE GUETARIA 73- 85 (Locales 3 y 4) ,Bicipark Canalejas,-,5867.94
1031,Escuela Infantil B.R.A. Institucion Orgaz,CALLE FRASCUELO 2,Bicipark Recuerdo,"Calle Hiedra, 26",3473.57
1032,Escuela Infantil Cadi Centro de Atención y Desarrollo Infantil,AVENIDA SANTUARIO DE VALVERDE 11,Bicipark Pitis,"Calle Pau Arroyo del Fresno, 181",1843.41
1033,Escuela Infantil Calasanz,CALLE MADRE ROSA BLANCO 5,Bicipark Canalejas,-,5128.73
1034,Escuela Infantil Can - Ta - Chimutri (Sol y Luna),CALLE RUPERTO ANDRES 6,Bicipark Orense,"Avenida General Perón, 27",2990.43
1035,Escuela Infantil Cangurito,CALLE GENERAL ARANAZ 65,Bicipark Salamanca,Pl. del Marqués de Salamanca,3601.93
1036,Escuela Infantil Caperucita,CALLE ISLA DE NELSON 12,Bicipark Orense,"Avenida General Perón, 27",2807.34
1037,Escuela Infantil Caracol 2000,CALLE JULIAN CAMARILLO 52,Bicipark Salamanca,Pl. del Marqués de Salamanca,5269.61
1038,Escuela Infantil Caracola,PASEO TIERRA DE MELIDE 28,Bicipark Fuente de la Mora,Estación de Fuente de la Mora,2485.66
1039,Escuela Infantil Carana Valdemarín,CALLE CARLOS SAN JOSE 7,Bicipark Pitis,"Calle Pau Arroyo del Fresno, 181",5871.43
1040,Escuela Infantil Carricoche,CALLE MOREJA 1,Bicipark Canalejas,-,5525.15
1041,Escuela Infantil Carrusel,CALLE LUIS DE SALAZAR 3,Bicipark Salamanca,Pl. del Marqués de Salamanca,2196.68
1042,Escuela Infantil Cascabel,CALLE CONDADO DE TREVIÑO 35,Bicipark Fuente de la Mora,Estación de Fuente de la Mora,662.39
1043,Escuela Infantil Casita  Maravillas,CALLE HIERRO 6,Bicipark Montalban,"Calle de Montalbán, 5",3041.86
1044,Escuela Infantil Casita Maravillas Nebulosas,CALLE NEBULOSAS 10,Bicipark Montalban,"Calle de Montalbán, 5",2639.1
1045,Escuela Infantil Catalina Laboure,CALLE MARROQUINA 45,Bicipark Salamanca,Pl. del Marqués de Salamanca,3565.97
1046,Escuela Infantil Centro de Primer Ciclo de E.I. de la Univ. Complutense,AVENIDA PUERTA DE HIERRO,Bicipark Orense,"Avenida General Perón, 27",3564.35
1047,Escuela Infantil Cervantes Baby,CALLE AVEFRIA 20,Bicipark Aviación,Parking Aviación Española,4541.88
1048,Escuela Infantil Chamberines,CALLE GARCIA DE PAREDES 14,Bicipark Almagro,"Calle Almagro, 11",1045.34
1049,Escuela Infantil Chavalitos,CALLE PRADALES 8,Bicipark Aviación,Parking Aviación Española,3712.62
1050,Escuela Infantil Chiqui,CALLE FERNANDO EL CATOLICO 13,Bicipark Almagro,"Calle Almagro, 11",1304.2
1051,Escuela Infantil Chiqui Moratalaz.,CALLE JOSE DEL PRADO Y PALACIO 3,Bicipark Salamanca,Pl. del Marqués de Salamanca,3131.94
1052,Escuela Infantil Chiquikid,CALLE MOLINOS 13,Bicipark Orense,"Avenida General Perón, 27",957.47
1053,Escuela Infantil Chiquitin Alcántara,CALLE ALCANTARA 52,Bicipark Salamanca,Pl. del Marqués de Salamanca,478.15
1054,Escuela Infantil Chiquitin Embajadores,CALLE SEBASTIAN ELCANO (Local) 16,Bicipark Canalejas,-,1469.73
1055,Escuela Infantil Chiquitín Nuevo Sur,CALLE SITIO DE EL ESCORIAL 4,Bicipark Aviación,Parking Aviación Española,2278.97
1056,Escuela Infantil Chiquitín Olimpio. Calle Olimpio López,CALLE OLIMPIO LOPEZ 10,Bicipark Fuente de la Mora,Estación de Fuente de la Mora,2035.2
1057,Escuela Infantil Chulapos,AVENIDA GRAN VIA DEL SURESTE 14,Bicipark Montalban,"Calle de Montalbán, 5",10503.92
1058,Escuela Infantil Chuly,CALLE NAVES 21,Bicipark Canalejas,-,2110.89
1059,Escuela Infantil Chupetines,CALLE ANTONIA RODRIGUEZ SACRISTAN 13,Bicipark Aviación,Parking Aviación Española,3307.84
1060,Escuela Infantil Cinco Estrellas,AVENIDA CANILLEJAS A VICALVARO 24,Bicipark Salamanca,Pl. del Marqués de Salamanca,5530.34
1061,Escuela Infantil Ciudad Jardín,CALLE COLOMBIA 42,Bicipark Recuerdo,"Calle Hiedra, 26",1879.22
1062,Escuela Infantil Coco,CALLE MONSEÑOR OSCAR ROMERO 72,Bicipark Aviación,Parking Aviación Española,3138.94
1063,Escuela Infantil Cocolankids,PASEO DOCTOR VALLEJO NAGERA 25,Bicipark Canalejas,-,1927.13
1064,Escuela Infantil Cocorico,CALLE CLARA DEL REY 8,Bicipark Salamanca,Pl. del Marqués de Salamanca,1375.21
1065,Escuela Infantil Colegio Hispano Alemán,CALLE ARGA 13,Bicipark Orense,"Avenida General Perón, 27",1147.15
1066,Escuela Infantil Colores Saltarines,CALLE VALLE DE ORO 10,Bicipark Canalejas,-,4189.01
1067,Escuela Infantil Colorín Colorado,CALLE CONDE DE TORRALBA 8,Bicipark Recuerdo,"Calle Hiedra, 26",826.01
1068,Escuela Infantil Colorines,CALLE FLORA TRISTAN 4,Bicipark Montalban,"Calle de Montalbán, 5",6864.14
1069,Escuela Infantil Colors,CALLE CONSENSO 25,Bicipark Montalban,"Calle de Montalbán, 5",6700.54
1070,Escuela Infantil Comendadoras de Santiago,PLAZA COMENDADORAS 10,Bicipark Villa de Paris,"Calle de Orellana, 23, 21",1306.22
1071,Escuela Infantil Conde de Elda,CALLE PONFERRADA 16,Bicipark Pitis,"Calle Pau Arroyo del Fresno, 181",2587.24
1072,Escuela Infantil Congreso de los Diputados,CARRERA SAN JERONIMO 36,Bicipark Canalejas,-,190.15
1073,Escuela Infantil Contumami la Vaguada,PLAZA FONSAGRADA 10,Bicipark Pitis,"Calle Pau Arroyo del Fresno, 181",2433.09
1074,Escuela Infantil Cosquillas II,CALLE TENIENTE CORONEL NOREÑA 26,Bicipark Canalejas,-,3322.55
1075,Escuela Infantil Creativa La Gavia,CALLE ENTREPE&amp;Ntilde;AS 27,Bicipark Montalban,"Calle de Montalbán, 5",8908.75
1076,Escuela Infantil Cri - Cri,CALLE CORREGIDOR JUAN FRANCISCO DE LUJAN 21,Bicipark Montalban,"Calle de Montalbán, 5",3989.05
1077,Escuela Infantil CSIC (Consejo Superior de Investigaciones Científicas),CALLE JORGE MANRIQUE 27,Bicipark Orense,"Avenida General Perón, 27",1242.52
1078,Escuela Infantil Cuartel General del Ejército del Aire,CALLE ROMERO ROBLEDO 8,Bicipark Almagro,"Calle Almagro, 11",2257.65
1079,Escuela Infantil Cuatro Pecas,RONDA SEGOVIA 13,Bicipark Canalejas,-,1665.11
1080,Escuela Infantil Cuatro Pecas El Carmen,CALLE CAPITAN SALAZAR MARTINEZ 9,Bicipark Canalejas,-,1568.29
1081,Escuela Infantil Cuchitos,CALLE GENERAL DIAZ PORLIER 99,Bicipark Salamanca,Pl. del Marqués de Salamanca,547.15
1082,Escuela Infantil Cucutrás,PLAZA PATRICIO AGUADO 6,Bicipark Fuente de la Mora,Estación de Fuente de la Mora,3159.53
1083,Escuela Infantil Cucutrás II,PLAZA PATRICIO AGUADO 6,Bicipark Fuente de la Mora,Estación de Fuente de la Mora,3157.32
1084,Escuela Infantil Cuentacuentos,AVENIDA PABLO NERUDA 51,Bicipark Montalban,"Calle de Montalbán, 5",5278.79
1085,Escuela Infantil Cuna de Jesús,CALLE FERRER DEL RIO 26,Bicipark Salamanca,Pl. del Marqués de Salamanca,850.02
1086,Escuela Infantil De Oca a Oca,CALLE TINTAS 6,Bicipark Aviación,Parking Aviación Española,3691.94
1087,Escuela Infantil De Peques,CALLE WALIA 7,Bicipark Montalban,"Calle de Montalbán, 5",1991.6
1088,Escuela Infantil del Complejo Cuzco,PASEO CASTELLANA 162,Bicipark Orense,"Avenida General Perón, 27",709.39
1089,Escuela Infantil del Cuerpo Nacional de Policía,CALLE JULIAN GONZALEZ SEGADOR S/N ,Bicipark Fuente de la Mora,Estación de Fuente de la Mora,2282.51
1090,Escuela Infantil del Ministerio de Defensa,PASEO CASTELLANA 109,Bicipark Orense,"Avenida General Perón, 27",377.4
1091,Escuela Infantil del Ministerio de Fomento,PASEO CASTELLANA 67,Bicipark Orense,"Avenida General Perón, 27",1058.66
1092,Escuela Infantil del Ministerio de Inmigración,CALLE JOSE ABASCAL 39,Bicipark Almagro,"Calle Almagro, 11",968.27
1093,Escuela Infantil Delphos,CALLE ESTRECHO DE COREA 34,Bicipark Salamanca,Pl. del Marqués de Salamanca,2916.78
1094,Escuela Infantil Denenes,CALLE VIRGEN DE LLUC 13,Bicipark Salamanca,Pl. del Marqués de Salamanca,2771.45
1095,Escuela Infantil Diábolo,CALLE CACERES 10,Bicipark Canalejas,-,2152.28
1096,Escuela Infantil Diciembre Garden,CALLE DICIEMBRE 41,Bicipark Fuente de la Mora,Estación de Fuente de la Mora,9167.55
1097,Escuela Infantil Dina Condado,CALLE CONDADO DE TREVIÑO 35,Bicipark Fuente de la Mora,Estación de Fuente de la Mora,662.39
1098,Escuela Infantil Dina Condado 2,CALLE CONDADO DE TREVIÑO 35,Bicipark Fuente de la Mora,Estación de Fuente de la Mora,662.39
1099,Escuela Infantil Diventium,CALLE EPOCA 6,Bicipark Aviación,Parking Aviación Española,3164.16
1100,Escuela Infantil Divertia,CALLE GOLFO DE SALONICA 25,Bicipark Fuente de la Mora,Estación de Fuente de la Mora,809.53
1101,Escuela Infantil Domo,CALLE TORREGROSA 16,Bicipark Fuente de la Mora,Estación de Fuente de la Mora,1910.15
1102,Escuela Infantil Don Melitón IV,AVENIDA CERRO MILANO 141,Bicipark Montalban,"Calle de Montalbán, 5",10651.91
1103,Escuela Infantil Don Meliton V,CALLE PUENTEDEY 29,Bicipark Montalban,"Calle de Montalbán, 5",8896.99
1104,Escuela Infantil Educando,CALLE DOCTOR ESQUERDO 183,Bicipark Montalban,"Calle de Montalbán, 5",2225.5
1105,Escuela Infantil Educando II,CALLE DOCTOR ESQUERDO 183,Bicipark Montalban,"Calle de Montalbán, 5",2225.5
1106,Escuela Infantil Educando Juntos,CALLE ADELFAS 12,Bicipark Montalban,"Calle de Montalbán, 5",2309.72
1107,Escuela Infantil Educando Pitufos,CALLE REYES MAGOS 6,Bicipark Montalban,"Calle de Montalbán, 5",1538.13
1108,Escuela Infantil Educavida Es-Cool,CALLE JUAN DE JUANES 10,Bicipark Montalban,"Calle de Montalbán, 5",2584.03
1109,Escuela Infantil Eduqa Las Tablas,AVENIDA BURGOS (Ciudad empresarial Adequa) 89,Bicipark Fuente de la Mora,Estación de Fuente de la Mora,1113.44
1110,Escuela Infantil Eduqa Valdebebas,CALLE VIA DE LOS POBLADOS 3,Bicipark Fuente de la Mora,Estación de Fuente de la Mora,2562.7
1111,Escuela Infantil El Arrullo,BULEVAR JOSE PRAT 7 LOCAL 1 - 2,Bicipark Salamanca,Pl. del Marqués de Salamanca,5824.15
1112,Escuela Infantil El Arrullo  V,AVENIDA DOCTOR GARCIA TAPIA 232,Bicipark Salamanca,Pl. del Marqués de Salamanca,5308.62
1113,Escuela Infantil El Arrullo I,CALLE PEÑA NUEVA 74,Bicipark Montalban,"Calle de Montalbán, 5",7957.72
1114,Escuela Infantil El Arrullo VI,CALLE MONTES DE BARBANZA 19,Bicipark Montalban,"Calle de Montalbán, 5",7591.82
1115,Escuela Infantil El Bebé,CALLE ISLAS MASCAREÑAS 11,Bicipark Pitis,"Calle Pau Arroyo del Fresno, 181",1837.52
1116,Escuela Infantil El Belén,CALLE BRAILLE 23,Bicipark Pitis,"Calle Pau Arroyo del Fresno, 181",2347.59
1117,Escuela Infantil El Bosque Encantado. Calle Antonio López,CALLE ANTONIO LOPEZ 246,Bicipark Canalejas,-,4003.13
1118,Escuela Infantil El Camino,CALLE SALITRE 33,Bicipark Canalejas,-,1014.94
1119,Escuela Infantil El Carmen. Calle Vélez Rubio,CALLE VELEZ RUBIO 181,Bicipark Fuente de la Mora,Estación de Fuente de la Mora,590.07
1120,Escuela Infantil El Chovo,CALLE CARLOS MARTIN ALVAREZ 23,Bicipark Montalban,"Calle de Montalbán, 5",3981.84
1121,Escuela Infantil El Desván II,CALLE LA DILIGENCIA 19,Bicipark Montalban,"Calle de Montalbán, 5",4974.45
