,place,place_address,station_name,station_address,distance
1346,Escuela infantil municipal Las Amapolas,CALLE OBOLO 14,Bicipark Aviación,Parking Aviación Española,3869.57
1347,Escuela infantil municipal Las Azaleas,CALLE PORTUGALETE 6,Bicipark Salamanca,Pl. del Marqués de Salamanca,3728.27
1348,Escuela infantil municipal Las Golondrinas,CALLE JOSEFA VALCARCEL 189,Bicipark Fuente de la Mora,Estación de Fuente de la Mora,5853.79
1349,Escuela infantil municipal Las Leandras,CALLE DEYANIRA 2,Bicipark Salamanca,Pl. del Marqués de Salamanca,7363.51
1350,Escuela infantil municipal Las Mercedes,CALLE SAMANIEGO 22,Bicipark Fuente de la Mora,Estación de Fuente de la Mora,8420.6
1351,Escuela infantil municipal Las Nubes,CALLE ANTONIO NEBRIJA 7,Bicipark Montalban,"Calle de Montalbán, 5",1703.6
1352,Escuela infantil municipal Las Pléyades,AVENIDA SECUNDINO ZUAZO 34,Bicipark Fuente de la Mora,Estación de Fuente de la Mora,3798.65
1353,Escuela infantil municipal Las Viñas,CALLE ESTUDIO 6,Bicipark Pitis,"Calle Pau Arroyo del Fresno, 181",6473.12
1354,Escuela infantil municipal Los Gavilanes,CALLE TIZIANO 7,Bicipark Orense,"Avenida General Perón, 27",754.74
1355,Escuela infantil municipal Los Juncos,PLAZA JUVENTUD 7,Bicipark Salamanca,Pl. del Marqués de Salamanca,6645.04
1356,Escuela infantil municipal Los Pinos,CALLE ROCAFORT 2,Bicipark Canalejas,-,8548.79
1357,Escuela infantil municipal Los sobrinos del Capitan Grant,AVENIDA LA GAVIA 22,Bicipark Montalban,"Calle de Montalbán, 5",8335.61
1358,Escuela infantil municipal Luis Bello,CALLE JUAN BAUTISTA DE TOLEDO 5,Bicipark Salamanca,Pl. del Marqués de Salamanca,1544.98
1359,Escuela infantil municipal Luisa Fernanda,CALLE COCHERON DE LA VILLA 29,Bicipark Montalban,"Calle de Montalbán, 5",6173.43
1360,Escuela infantil municipal Margarita Salas,CALLE CAVANILLES 58,Bicipark Montalban,"Calle de Montalbán, 5",2152.9
1361,Escuela infantil municipal Molinos de Viento,CAMINO FUENTE DE ARRIBA 4,Bicipark Salamanca,Pl. del Marqués de Salamanca,6592.1
1362,Escuela infantil municipal Osa Menor,CALLE MEJIA LEQUERICA 21,Bicipark Villa de Paris,"Calle de Orellana, 23, 21",560.77
1363,Escuela infantil municipal Parque de Ingenieros,CALLE LA TABERNERA DEL PUERTO 26,Bicipark Canalejas,-,6988.96
1364,Escuela infantil municipal Pensamiento,CALLE MIRASIERRA 27,Bicipark Canalejas,-,3191.89
1365,Escuela infantil municipal Poeta Gloria Fuertes,CALLE EUNATE 6,Bicipark Fuente de la Mora,Estación de Fuente de la Mora,2577.4
1366,Escuela infantil municipal Ruiz Jiménez,CALLE JOSE PICON 17,Bicipark Salamanca,Pl. del Marqués de Salamanca,783.08
1367,Escuela infantil municipal Sabina,CALLE CAÑÓN DEL RIO LOBOS 4,Bicipark Salamanca,Pl. del Marqués de Salamanca,4890.99
1368,Escuela infantil municipal Tarabilla,CALLE GANDHI 14,Bicipark Salamanca,Pl. del Marqués de Salamanca,3813.82
1369,Escuela infantil municipal VeoVeo,CALLE CONDESA DE VENADITO 3,Bicipark Salamanca,Pl. del Marqués de Salamanca,2534.54
1370,Escuela infantil municipal Villa de Vallecas,CALLE EMBALSE DE PINILLA 32,Bicipark Montalban,"Calle de Montalbán, 5",10379.86
1371,Escuela Infantil Muñecos,CALLE MINERVA 25,Bicipark Salamanca,Pl. del Marqués de Salamanca,7441.22
1372,Escuela Infantil Muñequito,CALLE POLAN 7 8,Bicipark Aviación,Parking Aviación Española,4974.55
1373,Escuela Infantil Nanos,CALLE LA BAÑEZA 43,Bicipark Pitis,"Calle Pau Arroyo del Fresno, 181",2404.9
1374,Escuela Infantil Nanos Doctor Vallejo,CALLE DOCTOR VALLEJO 3,Bicipark Salamanca,Pl. del Marqués de Salamanca,3114.31
1375,Escuela Infantil Nayer Kids,AVENIDA PESETA 22,Bicipark Aviación,Parking Aviación Española,2751.78
1376,Escuela Infantil Nazaret. Calle Arenas de Iguña,CALLE ARENAS DE IGUÑA 1,Bicipark Montalban,"Calle de Montalbán, 5",4762.15
1377,Escuela Infantil Nazaret. Calle Quintiliano,CALLE QUINTILIANO 3,Bicipark Salamanca,Pl. del Marqués de Salamanca,1284.36
1378,Escuela Infantil Nemomarlín,CALLE MELENDEZ VALDES 28,Bicipark Almagro,"Calle Almagro, 11",1577.04
1379,Escuela Infantil Nemomarlin Aravaca,CALLE LAMIACO 12,Bicipark Pitis,"Calle Pau Arroyo del Fresno, 181",8547.82
1380,Escuela Infantil Nemomarlín Arganzuela,CALLE CARMEN COBEÑA 4,Bicipark Canalejas,-,2129.41
1381,Escuela Infantil Nemomarlin Arroyo del Fresno,CALLE ARROYO DEL MONTE 53,Bicipark Pitis,"Calle Pau Arroyo del Fresno, 181",840.71
1382,Escuela Infantil Nemomarlin Butarque,CALLE BERROCAL 3,Bicipark Montalban,"Calle de Montalbán, 5",7927.89
1383,Escuela Infantil Nemomarlin Carabanchel,CALLE PINAR DE SAN JOSE 23,Bicipark Aviación,Parking Aviación Española,2766.29
1384,Escuela Infantil Nemomarlín Ciudad Jardín,CALLE NIEREMBERG 8,Bicipark Orense,"Avenida General Perón, 27",1993.17
1385,Escuela Infantil Nemomarlín Conde de Orgaz,CALLE TORONGA 25,Bicipark Recuerdo,"Calle Hiedra, 26",2999.17
1386,Escuela Infantil Nemomarlín Cuatro Caminos,CALLE BRAVO MURILLO 107,Bicipark Orense,"Avenida General Perón, 27",1119.72
1387,Escuela Infantil Nemomarlín Guindalera,CALLE MARIA TERESA 14,Bicipark Salamanca,Pl. del Marqués de Salamanca,1078.93
1388,Escuela Infantil Nemomarlín Las Tablas,CALLE FROMISTA 5,Bicipark Fuente de la Mora,Estación de Fuente de la Mora,2988.87
1389,Escuela Infantil Nemomarlin Montecarmelo,CALLE MONASTERIO DE LAS BATUECAS 15,Bicipark Pitis,"Calle Pau Arroyo del Fresno, 181",1887.71
1390,Escuela Infantil Nemomarlín Paseo de la Habana,PASEO LA HABANA (LOCAL 1 Y 2) 87,Bicipark Orense,"Avenida General Perón, 27",1142.07
1391,Escuela Infantil Nemomarlín Pintor Rosales,PASEO PINTOR ROSALES 32,Bicipark Canalejas,-,2026.14
1392,Escuela Infantil Nemomarlín Retiro,AVENIDA MENENDEZ PELAYO 71,Bicipark Montalban,"Calle de Montalbán, 5",1469.25
1393,Escuela Infantil Nemomarlín Sanchinarro,AVENIDA ALCALDE CONDE DE MAYALDE 7,Bicipark Fuente de la Mora,Estación de Fuente de la Mora,1031.05
1394,Escuela Infantil Nemomarlín Valdebebas,AVENIDA JUAN ANTONIO SAMARANCH 37,Bicipark Fuente de la Mora,Estación de Fuente de la Mora,3872.15
1395,Escuela Infantil Nenúfar,CALLE VILLAJIMENA 30,Bicipark Salamanca,Pl. del Marqués de Salamanca,6801.16
1396,Escuela Infantil Nubbe,PLAZA TRES OLIVOS 16,Bicipark Fuente de la Mora,Estación de Fuente de la Mora,2974.97
1397,Escuela Infantil Nubes 2,CALLE SANTA SATURNINA 11,Bicipark Canalejas,-,2662.77
1398,Escuela Infantil Nubes. Calle Gabriel Usera 39,CALLE GABRIEL USERA 39,Bicipark Canalejas,-,3776.66
1399,Escuela Infantil Nuestra Señora de la Encarnación,PLAZA INMACULADA CONCEPCION 1,Bicipark Canalejas,-,2966.5
1400,Escuela Infantil Nuestra Señora de la Providencia,CALLE MARQUES DE PORTUGALETE 14,Bicipark Salamanca,Pl. del Marqués de Salamanca,3390.34
1401,Escuela Infantil Nuestra Señora de las Victorias,CALLE FRAY JUNIPERO SERRA 26 SITUADA EN LA MISMA PARROQUIA,Bicipark Orense,"Avenida General Perón, 27",1393.19
1402,Escuela Infantil Nuestra Señora de los Dolores,CALLE SAN BERNARDO 99,Bicipark Almagro,"Calle Almagro, 11",1083.03
1403,Escuela Infantil Nuestra Señora del Camino,CALLE MARTINEZ DE LA RIVA 127 PLAZA PEñA GUDINA S/N,Bicipark Montalban,"Calle de Montalbán, 5",4229.87
1404,Escuela Infantil Nuestra Señora del Rosario,"CALLE RELAMPAGUITO C/  PUEBLA DE SANABRIA , 20",Bicipark Aviación,Parking Aviación Española,7391.02
1405,Escuela Infantil Nueva Vida, SAMBARA 80,Bicipark Salamanca,Pl. del Marqués de Salamanca,2757.0
1406,Escuela Infantil Nuevo Cascabel,CALLE GOLFO DE SALONICA 29,Bicipark Fuente de la Mora,Estación de Fuente de la Mora,742.43
1407,Escuela Infantil Ñecos,CALLE GUILLEN DE CASTRO 10,Bicipark Salamanca,Pl. del Marqués de Salamanca,2945.89
1408,Escuela Infantil Okapi,CALLE CORREGIDOR JOSE DE PASAMONTE 24,Bicipark Salamanca,Pl. del Marqués de Salamanca,3474.73
1409,Escuela Infantil Olavide,CALLE GENERAL ALVAREZ DE CASTRO 22,Bicipark Almagro,"Calle Almagro, 11",985.85
1410,Escuela Infantil Ori Ori,CALLE SANTA TECLA 3,Bicipark Salamanca,Pl. del Marqués de Salamanca,5681.19
1411,Escuela Infantil Osobuco,CALLE HUELVA 4,Bicipark Salamanca,Pl. del Marqués de Salamanca,2399.66
1412,Escuela Infantil Osobuco II,AVENIDA ALFONSO XIII 30,Bicipark Orense,"Avenida General Perón, 27",2271.06
1413,Escuela Infantil Palmas Palmitas,CALLE SAN JUAN DE ORTEGA S/N,Bicipark Fuente de la Mora,Estación de Fuente de la Mora,2092.53
1414,Escuela Infantil Parque de Hortaleza,CALLE MAR CASPIO 6,Bicipark Fuente de la Mora,Estación de Fuente de la Mora,2035.77
1415,Escuela Infantil Pasitos,CALLE ANDORRA 3,Bicipark Fuente de la Mora,Estación de Fuente de la Mora,2866.18
1416,Escuela Infantil Paso a paso,CALLE VALDELASIERRA 7-B ,Bicipark Canalejas,-,2278.27
1417,Escuela Infantil Patuco,CALLE CASTILLEJOS 24,Bicipark Orense,"Avenida General Perón, 27",1144.65
1418,Escuela Infantil Pekes,CALLE REAL DE ARGANDA 32,Bicipark Montalban,"Calle de Montalbán, 5",7488.92
1419,Escuela Infantil Pelocho,CALLE LIGONDE 3,Bicipark Fuente de la Mora,Estación de Fuente de la Mora,3013.17
1420,Escuela Infantil Pentapolín,CALLE ANTONIO SANFIZ 24,Bicipark Pitis,"Calle Pau Arroyo del Fresno, 181",6565.25
1421,Escuela Infantil Pepito Grillo,PASEO GINEBRA 45,Bicipark Salamanca,Pl. del Marqués de Salamanca,6160.82
1422,Escuela Infantil Pequeando,CALLE ALCALDE HENCHE DE LA PLATA 32,Bicipark Fuente de la Mora,Estación de Fuente de la Mora,1318.43
1423,Escuela Infantil Pequemun,CALLE OLIVOS 8,Bicipark Orense,"Avenida General Perón, 27",2171.78
1424,Escuela Infantil Pequeña Gaia,CALLE BERROCAL 72,Bicipark Montalban,"Calle de Montalbán, 5",8674.22
1425,Escuela Infantil Pequeñecos Parque Norte,CALLE SERRANO GALVACHE 56,Bicipark Recuerdo,"Calle Hiedra, 26",757.35
1426,Escuela Infantil Pequeñilandia,CALLE VIRGEN DE LOS DESAMPARADOS 42,Bicipark Canalejas,-,7563.39
1427,Escuela Infantil Pequeñines. Calle Pingüino,CALLE PINGÜINO 7,Bicipark Aviación,Parking Aviación Española,2836.12
1428,Escuela Infantil Pequeño Koala,CAMINO VIEJO DE VICALVARO 20,Bicipark Salamanca,Pl. del Marqués de Salamanca,6094.81
1429,Escuela Infantil Pequeños Amigos,AVENIDA MONASTERIO DE EL ESCORIAL 74,Bicipark Pitis,"Calle Pau Arroyo del Fresno, 181",2947.94
1430,Escuela Infantil Pequeños Bichitos,CALLE OCAÑA 12,Bicipark Aviación,Parking Aviación Española,2458.81
1431,Escuela Infantil Peques. Calle Fernando VII.,CALLE FERNANDO VII 5,Bicipark Salamanca,Pl. del Marqués de Salamanca,5178.11
1432,Escuela Infantil Peque`s School,AVENIDA BETANZOS 78,Bicipark Pitis,"Calle Pau Arroyo del Fresno, 181",1768.86
1433,Escuela Infantil Petirrojo,CALLE LUIS BUÑUEL 4,Bicipark Montalban,"Calle de Montalbán, 5",5237.26
1434,Escuela Infantil Pícolos,CALLE VALMOJADO 117,Bicipark Aviación,Parking Aviación Española,2420.06
1435,Escuela Infantil Pipolandia 2,CALLE CACERES 50,Bicipark Canalejas,-,2088.88
1436,Escuela Infantil Pipo's. Calle Cáceres,CALLE CACERES 50,Bicipark Canalejas,-,2088.81
1437,Escuela Infantil Pipo's. Calle General Palanca,CALLE GENERAL PALANCA 4,Bicipark Canalejas,-,2032.88
1438,Escuela Infantil Pippo,CALLE CLARA DEL REY 33,Bicipark Salamanca,Pl. del Marqués de Salamanca,1481.99
1439,Escuela Infantil Piruetas,AVENIDA CANILLEJAS A VICALVARO 82,Bicipark Salamanca,Pl. del Marqués de Salamanca,5755.51
1440,Escuela Infantil Pompas,CALLE LOS YEBENES 255,Bicipark Aviación,Parking Aviación Española,2800.06
1441,Escuela Infantil Pozo del Tio Raimundo,CALLE VILLACARRILLO 4,Bicipark Montalban,"Calle de Montalbán, 5",5266.87
1442,Escuela Infantil Pradolongo,AVENIDA POBLADOS 144,Bicipark Canalejas,-,5133.6
1443,Escuela Infantil Preschool Fem,CALLE OLIVOS 9,Bicipark Orense,"Avenida General Perón, 27",2211.14
1444,Escuela Infantil Projardín Bruselas,CALLE BRISTOL 1,Bicipark Salamanca,Pl. del Marqués de Salamanca,1713.97
1445,Escuela Infantil Projardín Delicias,PASEO DELICIAS 65,Bicipark Canalejas,-,2173.6
1446,Escuela Infantil Projardín Madrid - 2,CALLE FERMIN CABALLERO 61,Bicipark Pitis,"Calle Pau Arroyo del Fresno, 181",1944.98
1447,Escuela Infantil Projardín Pinar,CALLE RAMON CAMARERO 3,Bicipark Pitis,"Calle Pau Arroyo del Fresno, 181",1618.87
1448,Escuela Infantil Projardín Retiro,PLAZA DOCTOR LAGUNA 5,Bicipark Montalban,"Calle de Montalbán, 5",1573.64
1449,Escuela Infantil Projardín Valdebebas,CALLE MARIA DE LAS MERCEDES DE BORBON 162,Bicipark Fuente de la Mora,Estación de Fuente de la Mora,4036.15
1450,Escuela Infantil Projardín Ventas,CALLE RAMON PATUEL 10,Bicipark Salamanca,Pl. del Marqués de Salamanca,1964.64
1451,Escuela Infantil Pública Cinco Lobitos,CALLE MORALES s/n,Bicipark Aviación,Parking Aviación Española,3060.65
1452,Escuela Infantil Puerta del Ángel,CALLE JUAN TORNERO 13,Bicipark Canalejas,-,2478.82
1453,Escuela Infantil Quita y Pon,CALLE DON QUIJOTE 41,Bicipark Orense,"Avenida General Perón, 27",548.5
1454,Escuela Infantil Rayuela,AVENIDA VILLA DE VALLECAS,Bicipark Montalban,"Calle de Montalbán, 5",8094.99
1455,Escuela Infantil Reggio,CALLE SAN JUAN DE ORTEGA 20,Bicipark Fuente de la Mora,Estación de Fuente de la Mora,2406.61
1456,Escuela Infantil Reina de los Ángeles,CALLE DARRO 30,Bicipark Orense,"Avenida General Perón, 27",727.11
1457,Escuela Infantil Retamar,CALLE FELIPE DE DIEGO 8,Bicipark Montalban,"Calle de Montalbán, 5",5052.52
1458,Escuela Infantil Risitas,CALLE JOAQUIN COSTA 12,Bicipark Orense,"Avenida General Perón, 27",990.8
1459,Escuela Infantil Rocío Jurado,CALLE BRIVIESCA 6,Bicipark Fuente de la Mora,Estación de Fuente de la Mora,442.09
1460,Escuela Infantil Rocío Durcal,AVENIDA Avenida Ingeniero Emilio Herrera 12,Bicipark Fuente de la Mora,Estación de Fuente de la Mora,970.14
1461,Escuela Infantil Roger de Flor,PLAZA ROGER DE FLOR 18,Bicipark Canalejas,-,3884.59
1462,Escuela Infantil Rosa,PASEO HABANA 173,Bicipark Recuerdo,"Calle Hiedra, 26",762.94
1463,Escuela Infantil Rosalía Rendú,CALLE ESPADA 9,Bicipark Canalejas,-,817.09
1464,Escuela Infantil Sagrada Familia,CALLE RICARDO ORTIZ 114,Bicipark Salamanca,Pl. del Marqués de Salamanca,2034.41
1465,Escuela Infantil Sagrados Corazones,CALLE GENERAL CABRERA 19 23,Bicipark Orense,"Avenida General Perón, 27",349.64
1466,Escuela Infantil San Alonso de Orozco,CALLE VICENTE ALEIXANDRE 6,Bicipark Orense,"Avenida General Perón, 27",2183.77
1467,Escuela Infantil San Fermín,CALLE ESTAFETA 14,Bicipark Canalejas,-,4893.15
1468,Escuela Infantil San Gabriel Arcángel,CALLE ISLA DE NELSON 1,Bicipark Orense,"Avenida General Perón, 27",2812.18
1469,Escuela Infantil San Jorge,CALLE GENERAL ARANAZ 85,Bicipark Salamanca,Pl. del Marqués de Salamanca,3388.68
1470,Escuela Infantil San José de Cluny,CALLE SAN RESTITUTO 24,Bicipark Orense,"Avenida General Perón, 27",2027.52
1471,Escuela infantil San Marcos American Preschool Madrid,CALLE MELENDEZ VALDES 36,Bicipark Almagro,"Calle Almagro, 11",1707.17
1472,Escuela Infantil San Miguel II,CALLE CASTUERA 16,Bicipark Aviación,Parking Aviación Española,3605.59
1473,Escuela Infantil San Roque,"CALLE ABOLENGO 10 C/V C/ OCA, 35",Bicipark Aviación,Parking Aviación Española,4056.46
1474,Escuela Infantil San Simón y San Judas,CALLE CAMPOTEJAR 39,Bicipark Canalejas,-,5953.01
1475,Escuela Infantil San Vicente de Paul,PLAZA SAN VICENTE DE PAUL 1,Bicipark Canalejas,-,4247.73
1476,Escuela Infantil San Víctor,PLAZA PICO SALVAGUARDIA 3,Bicipark Pitis,"Calle Pau Arroyo del Fresno, 181",1585.39
1477,Escuela Infantil Sancalo,CALLE VIRGEN DE ARANZAZU 1,Bicipark Recuerdo,"Calle Hiedra, 26",1692.38
1478,Escuela Infantil Sandy,CALLE SEO DE URGEL 15,Bicipark Fuente de la Mora,Estación de Fuente de la Mora,1914.33
1479,Escuela Infantil Santa Bernardita,CALLE PRINCIPE DE ASTURIAS 10,Bicipark Salamanca,Pl. del Marqués de Salamanca,686.0
1480,Escuela Infantil Santa Catalina,CALLE FUENTE DEL REY 44,Bicipark Pitis,"Calle Pau Arroyo del Fresno, 181",6078.56
1481,Escuela Infantil Santa Claus,CALLE NAPOLES 28,Bicipark Recuerdo,"Calle Hiedra, 26",2795.97
1482,Escuela Infantil Santa Elena,CALLE ESCALONA 81,Bicipark Aviación,Parking Aviación Española,2292.69
1483,Escuela Infantil Santa Eugenia,CALLE PUENTELARRA 9,Bicipark Salamanca,Pl. del Marqués de Salamanca,7988.48
1484,Escuela Infantil Santa Luisa,CALLE TANTALO 21,Bicipark Montalban,"Calle de Montalbán, 5",7301.16
1485,Escuela Infantil Santa María,CALLE VIRGEN DE LLUC 60,Bicipark Salamanca,Pl. del Marqués de Salamanca,2568.11
1486,Escuela Infantil Santa Mónica,CALLE VILLAMANIN 29,Bicipark Aviación,Parking Aviación Española,3749.07
1487,Escuela Infantil Santa Rosalía,CALLE MOTILLA DEL PALANCAR 36,Bicipark Fuente de la Mora,Estación de Fuente de la Mora,3405.22
1488,Escuela Infantil Santa Teresa,"AVENIDA ANDALUCIA 10,2",Bicipark Canalejas,-,4804.17
1489,Escuela Infantil Shantala,CALLE MARTINEZ DE LA RIVA S/N ,Bicipark Montalban,"Calle de Montalbán, 5",3941.01
1490,Escuela Infantil Sierra de Filabres Es-Cool,CALLE SIERRA DE FILABRES 71,Bicipark Montalban,"Calle de Montalbán, 5",3359.5
1491,Escuela Infantil Smiles Bilingual Nursery School,CALLE PUENTE LA REINA 36,Bicipark Fuente de la Mora,Estación de Fuente de la Mora,2273.19
1492,Escuela Infantil Sol Solito,CALLE MONASTERIO DE GUADALUPE 9,Bicipark Pitis,"Calle Pau Arroyo del Fresno, 181",2189.11
1493,Escuela Infantil St Alice's Nursery,CALLE FERNANDEZ DE LA HOZ 21,Bicipark Almagro,"Calle Almagro, 11",409.75
1494,Escuela Infantil St Alice's Nursery Galileo,CALLE GALILEO 47,Bicipark Almagro,"Calle Almagro, 11",1558.78
1495,Escuela Infantil Suecia Garden,CALLE SUECIA 11,Bicipark Salamanca,Pl. del Marqués de Salamanca,6072.73
1496,Escuela Infantil Sunny Baby,CALLE CONCEJAL FRANCISCO JOSE JIMENEZ MARTIN 122,Bicipark Canalejas,-,3175.61
1497,Escuela Infantil Superkids Daycare,AVENIDA MONASTERIO DE EL ESCORIAL 36,Bicipark Pitis,"Calle Pau Arroyo del Fresno, 181",2122.9
1498,Escuela Infantil Surikata,CALLE MANUEL POMBO ANGULO 24,Bicipark Fuente de la Mora,Estación de Fuente de la Mora,2641.36
1499,Escuela Infantil Tábata,CALLE CELANOVA 9,Bicipark Orense,"Avenida General Perón, 27",2716.67
1500,Escuela Infantil Tania Jardin,AVENIDA PALOMERAS 29,Bicipark Montalban,"Calle de Montalbán, 5",4356.52
1501,Escuela Infantil Tanuca,CALLE LONGARES 36,Bicipark Salamanca,Pl. del Marqués de Salamanca,5918.4
1502,Escuela Infantil Teddy,CALLE LEON GIL DE PALACIO 5,Bicipark Montalban,"Calle de Montalbán, 5",2006.88
1503,Escuela Infantil Teo Breton,CALLE BRETON DE LOS HERREROS 46,Bicipark Almagro,"Calle Almagro, 11",996.61
1504,Escuela Infantil Tiny Tots,AVENIDA PRUNOS 80,Bicipark Fuente de la Mora,Estación de Fuente de la Mora,5044.84
1505,Escuela Infantil Tobogán II,CALLE FERNANDO DIAZ DE MENDOZA 67,Bicipark Canalejas,-,2922.76
1506,Escuela Infantil Todo Niños Nursery,CAMINO BARRIAL 38,Bicipark Pitis,"Calle Pau Arroyo del Fresno, 181",6807.91
1507,Escuela Infantil Todo Niños Nursery Serrano,CALLE SERRANO 163,Bicipark Orense,"Avenida General Perón, 27",1013.85
1508,Escuela Infantil Todo para la Infancia,AVENIDA DOCTOR FEDERICO RUBIO Y GALI 106,Bicipark Orense,"Avenida General Perón, 27",1732.51
1509,Escuela Infantil Topochitos,CALLE VILLAVA 12,Bicipark Fuente de la Mora,Estación de Fuente de la Mora,1973.58
1510,Escuela Infantil Topochitos II,"CALLE CIRAUQUI , c/v CALLE VALCARLOS ",Bicipark Fuente de la Mora,Estación de Fuente de la Mora,1758.46
1511,Escuela Infantil Toscana Garden,CALLE TOSCANA 114,Bicipark Salamanca,Pl. del Marqués de Salamanca,5710.62
1512,Escuela Infantil Trapitos,CALLE LIMONITA 1 c/v C/ Estefanita,Bicipark Montalban,"Calle de Montalbán, 5",8423.97
1513,Escuela Infantil Trazos,CALLE CONDES DE TORREANAZ 4,Bicipark Salamanca,Pl. del Marqués de Salamanca,1390.3
1514,Escuela Infantil Trébol,CALLE FINISTERRE 6 BAJO,Bicipark Recuerdo,"Calle Hiedra, 26",1947.73
1515,Escuela Infantil Valle de Oro,CALLE VALLE DE ORO 35,Bicipark Canalejas,-,4189.19
1516,Escuela Infantil Vallehermoso,CALLE FERNANDEZ DE LOS RIOS 42,Bicipark Almagro,"Calle Almagro, 11",1460.8
1517,Escuela Infantil Verbo Encarnado,CALLE ALENZA 28,Bicipark Orense,"Avenida General Perón, 27",978.44
1518,Escuela Infantil Vida,CALLE CORREGIDOR JOSE DE PASAMONTE 7,Bicipark Salamanca,Pl. del Marqués de Salamanca,3338.57
1519,Escuela Infantil Virgen de Begoña,CALLE ANGEL MUGICA 48,Bicipark Recuerdo,"Calle Hiedra, 26",1821.77
1520,Escuela Infantil Virgen del Parque,CALLE JACOBINIA 74,Bicipark Aviación,Parking Aviación Española,2622.83
1521,Escuela Infantil Woody,CALLE CAMARENA 96,Bicipark Aviación,Parking Aviación Española,2525.97
1522,Escuela Infantil Zaleo,CALLE FUENTE DE PIEDRA 10,Bicipark Montalban,"Calle de Montalbán, 5",5818.79
1523,Escuela Infantil Zazuar I,AVENIDA SANTA EUGENIA 62,Bicipark Montalban,"Calle de Montalbán, 5",8198.53
1524,Escuela Infantil Zazuar II,CALLE FUENTESPINA 17,Bicipark Montalban,"Calle de Montalbán, 5",8373.33
1525,Escuela Infantil Zazuar III,CALLE ZAZUAR 2,Bicipark Salamanca,Pl. del Marqués de Salamanca,8103.0
1526,Escuela Infantil Zofio,CALLE FORNILLOS 3,Bicipark Canalejas,-,4114.03
1527,"Escuela Infantil 'Eduka, Escuela Infantil'",CALLE ALICIA BAENA 19,Bicipark Pitis,"Calle Pau Arroyo del Fresno, 181",1726.73
1528,Escuela Infantil 'Infantil Peques',CALLE ANGOSTA 3,Bicipark Aviación,Parking Aviación Española,7490.96
1529,Escuela Infantil - Casa de Niños Bravo Murillo,CALLE ISLAS CIES 11,Bicipark Pitis,"Calle Pau Arroyo del Fresno, 181",1775.88
1530,Escuela Infantil ¿Dónde están las llaves?,CALLE TOMAS BRETON 58,Bicipark Montalban,"Calle de Montalbán, 5",2409.61
1531,Escuela Infantil-Casa de Niños Albaicín,CALLE ALBAICIN 1,Bicipark Canalejas,-,5485.79
1532,Escuela Infantil-Casa de Niños El Señor don Gato,CALLE POETAS S/N,Bicipark Salamanca,Pl. del Marqués de Salamanca,5872.97
1533,Escuela Infantil-Casa de Niños El Trébol,CALLE TRISTANA 2,Bicipark Montalban,"Calle de Montalbán, 5",4991.4
1534,Escuela Internacional de Protocolo,CALLE VASCOS 17,Bicipark Orense,"Avenida General Perón, 27",1549.82
1535,Escuela Municipal de Arte Dramático,CALLE MEJIA LEQUERICA 21,Bicipark Villa de Paris,"Calle de Orellana, 23, 21",560.77
1536,Escuela municipal de música Federico Chueca (Hortaleza),CALLE BENITA AVILA 23,Bicipark Fuente de la Mora,Estación de Fuente de la Mora,2379.14
1537,Escuela municipal de música Almudena Cano (Arganzuela),PASAJE TORTOSA 4,Bicipark Montalban,"Calle de Montalbán, 5",1386.2
1538,Escuela municipal de música Antonio Machado (San Blas-Canillejas),CALLE SAN ROMAN DEL VALLE 8,Bicipark Salamanca,Pl. del Marqués de Salamanca,4987.87
1539,Escuela municipal de música Antón García Abril (Villaverde),CALLE DOCTOR MARTIN AREVALO 2,Bicipark Aviación,Parking Aviación Española,7589.82
1540,Escuela municipal de música Carmelo Alonso Bernaola (Fuencarral-El Pardo),AVENIDA SOTO PALACIOS 7,Bicipark Fuente de la Mora,Estación de Fuente de la Mora,1876.1
1541,Escuela municipal de música de Vicálvaro,BULEVAR INDALECIO PRIETO 16,Bicipark Salamanca,Pl. del Marqués de Salamanca,5834.37
1542,Escuela municipal de música Isaac Albéniz (Carabanchel),CALLE LONJA DE LA SEDA 4,Bicipark Aviación,Parking Aviación Española,3089.32
1543,Escuela municipal de música Maestro Barbieri (Usera),CALLE CESTONA 3,Bicipark Canalejas,-,5155.19
1544,Escuela municipal de música Manuel Vázquez Montalbán (Tetuán),CALLE FRANCOS RODRIGUEZ 67,Bicipark Orense,"Avenida General Perón, 27",1495.22
1545,Escuela municipal de música María Rodrigo (Chamartín),CALLE MANTUANO 51,Bicipark Orense,"Avenida General Perón, 27",1589.76
1546,Escuela municipal de música Moratalaz,CALLE CORREGIDOR DIEGO DE VALDERRABANO 66,Bicipark Salamanca,Pl. del Marqués de Salamanca,2740.29
1547,Escuela municipal de música Villa de Vallecas,CALLE AGUSTIN GARCIA MALLA 4,Bicipark Montalban,"Calle de Montalbán, 5",7476.11
1548,Escuela municipal de música y danza Plácido Domingo (Retiro),CALLE TELLEZ 31,Bicipark Montalban,"Calle de Montalbán, 5",2139.44
1549,Escuela Oficial de Idiomas de Madrid - Carabanchel,CALLE PORTALEGRE 52,Bicipark Canalejas,-,3909.47
1550,Escuela Oficial de Idiomas de Madrid - Ciudad Lineal,CALLE CARLOTA O'NEILL 15,Bicipark Salamanca,Pl. del Marqués de Salamanca,2861.85
1551,Escuela Oficial de Idiomas de Madrid - Embajadores,CALLE EMBAJADORES 68,Bicipark Canalejas,-,1315.57
1552,Escuela Oficial de Idiomas de Madrid - Jesús Maestro,CALLE JESUS MAESTRO 5,Bicipark Almagro,"Calle Almagro, 11",1933.78
1553,Escuela Oficial de Idiomas de Madrid - Moratalaz,CALLE VALDEBERNARDO 3,Bicipark Salamanca,Pl. del Marqués de Salamanca,5268.76
1554,Escuela Oficial de Idiomas de Madrid - San Blas,CALLE CONSERVEROS  sin número,Bicipark Salamanca,Pl. del Marqués de Salamanca,5175.66
1555,Escuela Oficial de Idiomas de Madrid - Tribunal,CALLE SANTA BRIGIDA 10,Bicipark Villa de Paris,"Calle de Orellana, 23, 21",539.17
1556,Escuela Oficial de Idiomas de Madrid - Valdezarza,CALLE FERMIN CABALLERO 92,Bicipark Pitis,"Calle Pau Arroyo del Fresno, 181",1995.32
1557,Escuela Oficial de Idiomas de Madrid - Villaverde,CALLE FERNANDO ORTIZ 2,Bicipark Canalejas,-,5627.25
1558,Escuela Profesional Don Bosco,CALLE MARIA AUXILIADORA 9,Bicipark Orense,"Avenida General Perón, 27",1899.16
1559,Escuela Profesional IEM,CALLE CONDE DE SERRALLO 6,Bicipark Recuerdo,"Calle Hiedra, 26",1234.98
1560,Escuela Profesional Primero de Mayo,CALLE BARROS 11,Bicipark Montalban,"Calle de Montalbán, 5",4997.71
1561,Escuela Profesional Superior de Madrid,CALLE BERNARDINO OBREGON 26,Bicipark Canalejas,-,1708.85
1562,Escuela Superior de Canto de Madrid,CALLE SAN BERNARDO 44,Bicipark Canalejas,-,996.55
1563,Escuela Superior de Conservación y Restauración de Bienes Culturales,CALLE GUILLERMO ROLLAND 2,Bicipark Canalejas,-,973.29
1564,Escuela Superior de Diseño,CALLE CAMINO DE LOS VINATEROS 106,Bicipark Salamanca,Pl. del Marqués de Salamanca,3488.43
1565,Escuela Superior de Formación,CALLE DOCTOR ESQUERDO 160,Bicipark Montalban,"Calle de Montalbán, 5",2223.41
1566,Escuela superior de música Forum Musikae,CALLE PIQUER 3,Bicipark Recuerdo,"Calle Hiedra, 26",1438.67
